uri,author,author_name,text,created_at,indexed_at,likes,reposts,replies,has_media,keyword
at://did:plc:rzemulqalqwar2a6dud4hk5z/app.bsky.feed.post/3lnf7zs26zk2o,ianrobo.bsky.social,Ianrobo,The thought that greens are progressive is hilarious .. same ones are against hs2 and electricity pylons to start with,2025-04-22T08:09:04.471Z,2025-04-22T08:09:05.982Z,6,2,2,True,HS2
at://did:plc:vv6sodi4lmn3w43op3nbh2wj/app.bsky.feed.post/3lnf7hg22ss23,jonbarnes.bsky.social,Jon Barnes,"Lots to agree with here. I think what the indywales movement articulates poorly, though, is why decision-making is poor here. 

It's because we don't have the tools. No control of economy, no control over things like HS2, Crown Estate, etc. 

Unfortunately, I think that's a x-party problem to solve.",2025-04-22T07:58:47.902Z,2025-04-22T07:58:51.382Z,1,0,1,True,HS2
at://did:plc:7ohj6mszyzoxrudrloocyith/app.bsky.feed.post/3lnefhudd2s2e,theblueacorn.bsky.social,Richard Sales,A recent BBC report on the giant tunnelling machines digging HS2 beneath London noticed in passing that many of the workers still traveled from Ireland to do the work as their fathers and grandfathers had done. Nobody actually used the word ‘Navvies’,2025-04-22T00:13:45.594Z,2025-04-22T00:13:46.284Z,1,0,0,False,HS2
at://did:plc:qbci7zjdgn5mxvx4y7zobd76/app.bsky.feed.post/3lnecpe6upk2q,jax1712.bsky.social,Jackie Nicholson,It’ll be another HS2 sham spending million or worse billions for nothing but mess and bs promises with just more corrupt shenanigans. Mostly a few people lining their pockets. Dont believe a word of it,2025-04-21T23:24:15.887Z,2025-04-21T23:24:16.678Z,0,0,0,False,HS2
at://did:plc:d5b7mvfb42ux2d6nsxaurxp3/app.bsky.feed.post/3lndylcptsc2n,chipper60.bsky.social,Chipper60🏴󠁧󠁢󠁳󠁣󠁴󠁿🏴󠁧󠁢󠁳󠁣󠁴󠁿🏴󠁧󠁢󠁳󠁣󠁴󠁿🏴󠁧󠁢󠁳󠁣󠁴󠁿,"I've been listing the corruption conduits for yonks,since 2011.some reckon £Trillion+ passed thru Tory mitts,HS2,HINKLEY POINT,GREENSILL,PPEVIP, NHS,total infrastructure,WATER COMPANIES,billions in debt,dished out £100bn in divis,Tories LOST?£265Bn per annum,LOST £60+Bn thru(fkn FRAUD)08 CRASH,£1Tr",2025-04-21T20:23:02.710Z,2025-04-21T20:23:03.594Z,4,1,0,True,HS2
at://did:plc:lmoidvibkq5jigf5h4onk4vs/app.bsky.feed.post/3lndwqlm3y22k,calymeneavfc.bsky.social,Colin,Oh. HS2! Almost as costly as Villa tickets! 🤣,2025-04-21T19:50:12.312Z,2025-04-21T19:50:12.881Z,1,0,1,False,HS2
at://did:plc:hrkl3rbcmv6ncyntwgqedrv7/app.bsky.feed.post/3lndwbgndfc25,jonesy73.bsky.social,jone-Z,"Another beauty.

The next episode is good too, majoring on HS2 project and the metro/tram system.",2025-04-21T19:41:43.794Z,2025-04-21T19:41:44.097Z,0,0,1,False,HS2
at://did:plc:gzrxhf3ppmshpsczh4jrgebc/app.bsky.feed.post/3lndqkyynfc24,jules-1.bsky.social,Jules,"Also, Scotland has to pay 8% of the disastrous projects Westminster provides for England. HS2 being the worst of many. but just you keep spouting the same daft figures. You cannot refute the other points. If you are Scottish then you have been completely Anglified.",2025-04-21T17:59:42.578Z,2025-04-21T17:59:44.077Z,1,0,1,False,HS2
at://did:plc:f56yqnhav6ku45xom37l6zyo/app.bsky.feed.post/3lndp2q5cq227,dhplover.bsky.social,Kelly,"When you spend two weeks on holiday and you come home to find that HS2 looks even worse than it before as it destroys your village. That used to be the rugby club, now it’s pillars for the viaduct to go over the motorway slip road.",2025-04-21T17:32:42.679Z,2025-04-21T17:32:44.681Z,1,0,0,True,HS2
at://did:plc:d5b7mvfb42ux2d6nsxaurxp3/app.bsky.feed.post/3lnd5qu23ac2d,chipper60.bsky.social,Chipper60🏴󠁧󠁢󠁳󠁣󠁴󠁿🏴󠁧󠁢󠁳󠁣󠁴󠁿🏴󠁧󠁢󠁳󠁣󠁴󠁿🏴󠁧󠁢󠁳󠁣󠁴󠁿,"Actually.the last govt.TORIES,were classed,in ENGLISH MSM PAPERS,as the most corrupt in our lifetime.you really need to check the numbers,it's mind boggling the 100s upon 100s of BILLIONS.GONE! £265Bn Tories lost!Per annum.£60bn thru FRAUD!per annum,PPEVIP,HS2,GREENSILL,HOL,HINKLEY,etc £1tr?",2025-04-21T12:22:57.610Z,2025-04-21T12:22:58.579Z,3,1,0,True,HS2
at://did:plc:jjoabwun256v5d4ndjuc5sly/app.bsky.feed.post/3lncxkxrovs2i,dominiccottrill.bsky.social,Dominic Cottrill,"If you do go there, can you find what HS2 are planning to do with the bridges over Old Oak Common lane.

There seems to be some confusion.",2025-04-21T10:32:17.756Z,2025-04-21T10:32:18.777Z,0,0,0,False,HS2
at://did:plc:dy3kvthvx7g3jpnyiwcuik7j/app.bsky.feed.post/3lncqftjjg22g,fuzzweed.co.uk,Fuzzweed,"Interesting. You can see HS2 on Google satellite images, but only on sections. I wonder why?
Added deliberately to help construction crews?
Automatic recognition of larger earth works?
Chance update of different satellite data sets?",2025-04-21T08:24:09.261Z,2025-04-21T08:24:37.382Z,3,0,2,True,HS2
at://did:plc:4uohnv5ybzy436p22e5wyhbp/app.bsky.feed.post/3lnbiyiwjjc22,quantinghome.bsky.social,Andrew Thomson,To be fair HS2 is closing major roads for 3 weeks over Easter.,2025-04-20T20:38:46.080Z,2025-04-20T20:38:46.977Z,1,0,0,False,HS2
at://did:plc:jtplsfq7l7tejicasho2krqp/app.bsky.feed.post/3lnbdijstl22i,closeapproaches.com,NEO Close Approaches,"2025 HC :: 1.21 LD
2025 HE :: 1.93 LD
2025 FK12 :: 9.47 LD
2025 HK :: 12.12 LD
436030 :: 22.09 LD
2003 HM :: 29.23 LD
2025 FV11 :: 30.06 LD
2020 YW3 :: 32.99 LD
2019 HS2 :: 94.32 LD
",2025-04-20T19:00:21.374595+00:00,2025-04-20T19:00:21.582Z,0,0,0,False,HS2
at://did:plc:z23xyfkzsfpl672btrwh4t2w/app.bsky.feed.post/3lnb7zrnqmp2i,oxford-by-otis.bsky.social,Oxford by Otis,HS2 Will Now Only Run Between Euston And Old Oak Common,2025-04-20T17:58:24.716Z,2025-04-20T17:58:25.985Z,0,0,0,True,HS2
at://did:plc:giktrsvzyucmnw4r5nbefqkl/app.bsky.feed.post/3lnaozwczgc2c,atemx-games.itch.io,Atemx Games,"Happy Easter! While you wait for the next episode — which is slowly but surely on its way — here’s a little treat: an Inanna Revenge version of an old AlwaysFan wallpaper, available for everyone. You can find the NSFW version on my Discord.
#inannarevenge #hs2 #honeyselect",2025-04-20T12:54:16.368Z,2025-04-20T12:54:20.881Z,1,0,0,True,HS2
at://did:plc:i2yagfa7yf5v7rk7hmyxzahg/app.bsky.feed.post/3lnan3sfbwf32,witewulf.cyberplace.social.ap.brid.gy,Gary Parker :party_porg:,Flying back into BHX you see the utterly pointless scar that #HS2 has left on the landscape 😳,2025-04-20T12:19:24.000Z,2025-04-20T12:21:14.684Z,1,0,0,False,HS2
at://did:plc:ghe4xszujuzhnxpmej4ofcfb/app.bsky.feed.post/3lnagsqwz5c2u,pharna.bsky.social,春奈,"HS2 has a molar mass of 30g or so.
That’s enough molecules to make a city stank lol",2025-04-20T10:27:05.929Z,2025-04-20T10:27:06.879Z,1,0,0,False,HS2
at://did:plc:ntxovp24al7qh7vknlf24yba/app.bsky.feed.post/3lnag6wcj322b,smkali.bsky.social,,"It's also one of the reasons why HS2 kept getting more expensive, they had to keep working around wildlife etc. There's a new book by Ezra Klein that's all about this in the US. On the other hand I'm very glad that someone brought in a law compelling new build flats/houses in London to be less ugly",2025-04-20T10:16:00.469Z,2025-04-20T10:13:25.980Z,0,0,0,False,HS2
at://did:plc:jcrjkey6zvrfns2hk5nqqyqp/app.bsky.feed.post/3lna66mtcjk2b,philsturgeon.com,Phil Sturgeon 🌳🚵⚓️,"That’s a photograph of Cubbington Wood, and there were no ancient trees in that stretch of the ancient replanted woodland. Cut down for timber long ago. 

The ancient woodland impact had been long misunderstood, and we do desperately need more train capacity. philsturgeon.com/hs2-was-neve...",2025-04-20T07:52:40.597Z,2025-04-20T07:52:42.079Z,0,1,0,True,HS2
at://did:plc:jcrjkey6zvrfns2hk5nqqyqp/app.bsky.feed.post/3lna5wgl5p22b,philsturgeon.com,Phil Sturgeon 🌳🚵⚓️,More important context: WT did not say 108 ancient woodlands are “threatened with damage” as you stated in the first post. Common misunderstanding that’s lead to a whole lot of confusion on the topic. philsturgeon.com/hs2-was-neve...,2025-04-20T07:48:05.604Z,2025-04-20T07:48:07.584Z,0,0,0,True,HS2
at://did:plc:jcrjkey6zvrfns2hk5nqqyqp/app.bsky.feed.post/3lna54tjvfs2b,philsturgeon.com,Phil Sturgeon 🌳🚵⚓️,Anti-HS2 campaigners also lied repeatedly about the environmental/woodland impact and environmental campaigners took them at their word with zero further research. philsturgeon.com/hs2-was-neve...,2025-04-20T07:33:46.775Z,2025-04-20T07:33:50.380Z,2,0,0,True,HS2
at://did:plc:j3662u74jzqgxtfmaavmnr6v/app.bsky.feed.post/3ln727wgqnc2n,richiethomas.bsky.social,Rich,"just like HS2 in the UK. Countries like Spain and China can do it, not tightly owned land of the US and UK",2025-04-19T21:09:09.522Z,2025-04-19T21:09:10.781Z,1,0,0,False,HS2
at://did:plc:2xzvhcdlzztifq7kdahbeedg/app.bsky.feed.post/3ln6zh2k2ls2b,johnlinford.co.uk,John,The HS1 HS2 link has been descoped for years!  And passport control wouldn't allow it.,2025-04-19T20:55:14.964Z,2025-04-19T20:55:15.877Z,0,0,1,False,HS2
at://did:plc:veizgv7rcvz55skilc2huugh/app.bsky.feed.post/3ln6yylt3e22h,bristolsocialist.bsky.social,Bristol Eco-Socialist(they/them)🏴󠁧󠁢󠁥󠁮󠁧󠁿,Agree to disagree with you on HS2 but we should always be united on trans rights 💚💚,2025-04-19T20:47:09.765Z,2025-04-19T20:47:11.782Z,1,0,0,False,HS2
at://did:plc:qog6nsef4qorna5p2gphot37/app.bsky.feed.post/3ln6xvqenoc22,ianpatterson.com,Ian,"Looking at HS2 kick off trains, they’re all classic compatible. Which open access operator is going to decide to try full EU width trains to make the most of the system? Would only be able to do London-Birmingham, or use HS1, but could show off different passenger options.",2025-04-19T20:27:40.120Z,2025-04-19T20:27:40.481Z,0,0,1,False,HS2
at://did:plc:cmowp6sbfohotaaamiia5tbx/app.bsky.feed.post/3ln6xhf3g5k2c,hs2ltd.bsky.social,HS2,"We've successfully installed a 14,500-tonne box structure, which will carry the #HS2 line under the A46 in #Warwickshire.
 
The team will now complete drainage works and install a new road surface and markings, before reopening the road at 6am on Thursday, 1 May.

@nationalhighways.bsky.social",2025-04-19T20:19:38.530Z,2025-04-19T20:19:40.576Z,9,2,0,True,HS2
at://did:plc:krp66vyk4wqmfxtcecitm77m/app.bsky.feed.post/3ln67ncqdyc2a,marknt.bsky.social,Mark Taylor,"Some pretty impressive steelwork going in for HS2, just outside Curzon Street Station in Birmingham.",2025-04-19T13:13:27.566Z,2025-04-19T13:13:32.984Z,2,0,0,True,HS2
at://did:plc:sf2v2mhvbouhmxthnfjkbz5a/app.bsky.feed.post/3ln5wxyp5dk26,redsamo.bsky.social,Redsamo,HS2 anyone?,2025-04-19T10:38:22.495Z,2025-04-19T10:38:22.779Z,0,0,0,True,HS2
at://did:plc:65ugwhu7egldruyzwisu455w/app.bsky.feed.post/3ln5wgmm5v22f,philsbodydouble.bsky.social,Phil Jones' body double,"After all, this is the UK, where a party elected by a minority, gets total control over what it will do to the UK thanks to FPTP, and in fact the PM can make generation spanning decisions on his own just like that, like cancelling HS2 for the entire North.

3",2025-04-19T10:28:39.389Z,2025-04-19T10:28:40.580Z,1,0,2,False,HS2
at://did:plc:xdpxyybtmmragq6kobtprfql/app.bsky.feed.post/3ln5jr5dtuk2x,seb2024.bsky.social,Seb Berry 🇺🇦,"BFP coverage of the Wendover #HS2 planning decision, with a quote from me. This proposal should have been seen off last year at the pre-planning application phase. BFP doesn't mention it was a #LibDem Cllr who proposed the motion to reject.  www.bucksfreepress.co.uk/news/2509948...",2025-04-19T06:41:53.842Z,2025-04-19T06:41:56.683Z,1,0,0,True,HS2
at://did:plc:ntlt7tq7poafy22jkms4rxgz/app.bsky.feed.post/3ln55ydkqxs2e,lowbudgetprod.bsky.social,Low Budget Productions,"We attempted to interview a certain lady, but unfortunately the interview did not go as planned. #HoneySelect2 #HS2 #HoneySelect #ハニーセレクト２",2025-04-19T03:11:10.228Z,2025-04-19T03:11:15.680Z,0,1,0,True,HS2
at://did:plc:ntlt7tq7poafy22jkms4rxgz/app.bsky.feed.post/3ln4v3f6t422l,lowbudgetprod.bsky.social,Low Budget Productions,"Group shots of the denizens of Beat City, AKA my #HoneySelect2 girls! #HS2 #HoneySelect #ハニーセレクト２",2025-04-19T00:31:48.987Z,2025-04-19T00:31:52.586Z,1,0,0,True,HS2
at://did:plc:qog6nsef4qorna5p2gphot37/app.bsky.feed.post/3ln4bkljhbe2p,ianpatterson.com,Ian,"... ② SO HS2 is building concrete portals, some over 200m long out from tunnel entrances, with perforations which eliminate the sonic effects as the train enters. Nice piece here on one set of those Chiltern tunnel portals. *huge*
www.ianvisits.co.uk/articles/hs2...",2025-04-18T18:42:23.839Z,2025-04-18T18:42:24.284Z,0,0,0,False,HS2
at://did:plc:7y346w6zzitbfq36mvhcj62o/app.bsky.feed.post/3ln3n24ar6s2r,peterand.bandcamp.com,Peter Rand,"ralphtonge.bandcamp.com/track/baile-...

My good friend Ralph Tonge has just released an EP of 4 instrumentals , titled ""Turbulence"", and is exhibiting now at 
Dusgadh Baile na Cille - open Monday to Saturday  from 10:30am - 5:30pm.
Free entry for all at at Baile na Cille, Timsgarry, Uig, HS2 9JD",2025-04-18T12:35:16.431Z,2025-04-18T12:35:26.282Z,1,0,0,True,HS2
at://did:plc:w2x4ym3mfcg6cccs67hpoprh/app.bsky.feed.post/3ln3kp5qgxs2w,r042.bsky.social,Word Art Online,Nothing will radicalise me against environmental campaigners harder than reading the comments on an article about HS2 fuck off I literally do not care about trees if they are getting in the way of the UK having a remotely functioning rail network,2025-04-18T11:53:21.405Z,2025-04-18T11:53:18.787Z,2,1,1,False,HS2
at://did:plc:yropdimt5qm6gsnxnszy5cur/app.bsky.feed.post/3ln3acwydek2t,gingertrevtrev.bsky.social,Trev Ellis 🏴󠁧󠁢󠁳󠁣󠁴󠁿 🇪🇺 #YES,"I'm a car driver. I would rather use public transport. When are you going to ""freeze"" rail fair increases?
When will you take action to ease congestion and free up capicity on our over-crowded rail network (aka 'reinstating HS2 as originally planned')?",2025-04-18T08:47:34.253Z,2025-04-18T08:47:34.979Z,16,2,0,False,HS2
at://did:plc:je7dsnz624przl5jbbocy5yp/app.bsky.feed.post/3ln2wzltm4w2n,ocn-london.bsky.social,Open Council Network London,"Buckinghamshire councillors REFUSE HS2 spring chamber application near Wendover, citing ""significant harm"" to the Chilterns National Landscape despite officer recommendation to approve. http://opencouncil.network/meetings/62821",2025-04-18T06:01:16Z,2025-04-18T06:01:17.086Z,0,0,0,False,HS2
at://did:plc:aomczwi45xkrvo7fa6yd66nc/app.bsky.feed.post/3ln2t2ftizs2e,mblobby.bsky.social,Robbie,"Can't get a train to go see my Dad in Newcastle for less than 250 quid but in most European countries you can travel the whole place for 50 quid. Nevermind though, HS2 soon",2025-04-18T04:50:09.180Z,2025-04-18T04:50:11.280Z,0,0,1,False,HS2
at://did:plc:eieucyycdvauquh54fehjba3/app.bsky.feed.post/3lmzliva5ls2a,sayno2sizewellc.bsky.social,Together Against Sizewell C,"""...impossible to imagine how EDF can have spent [£6.4bn]. Inspired no doubt by the #HS2 fiasco, EDF’s obvious game plan here has been to spaff enough public ££s [on Sizewell C] so that Ministers will be too embarrassed to cancel the whole bloody thing""
jonathonporritt.com/tidal-energy...",2025-04-17T17:02:25.427Z,2025-04-17T17:02:27.881Z,2,1,0,True,HS2
at://did:plc:qppqw636th4q4bn4bshq6auu/app.bsky.feed.post/3lmzh2qru7s2s,yingtongiddle.bsky.social,WindsLightToVariable,Agreed! The amount of taxpayers money they have wasted on IT tech that barely or doesn't work over the past 50 years would have paid for HS2 from London to Inverness!! 🙄🙄🙄,2025-04-17T15:42:56.026Z,2025-04-17T15:42:57.086Z,3,0,0,False,HS2
at://did:plc:2bffmluopgwofqko4pxc4y32/app.bsky.feed.post/3lmzfk3zh7s2c,gcarty80.bsky.social,George Carty,"It was designed for Mach 3 (unlike the Mach 2 Concorde) which necessitated steel or titanium construction as structure would get too hot for aluminium.

Similarly, isn't one of HS2's problems the amount of tunnelling imposed by the insane vertical curvature limits for a 400 km/h route?",2025-04-17T15:15:43.652Z,2025-04-17T15:15:44.681Z,0,0,0,False,HS2
at://did:plc:2bffmluopgwofqko4pxc4y32/app.bsky.feed.post/3lmzet263qk23,gcarty80.bsky.social,George Carty,To what extent does HS2 have a similar issue to the Boeing 2707: ie being designed for _too_ high a speed and thus being dramatically more expensive as a result?,2025-04-17T15:02:49.954Z,2025-04-17T15:02:51.187Z,0,0,1,False,HS2
at://did:plc:v3z44c7cazjojizgjouqpuis/app.bsky.feed.post/3lmzchd75lc2u,kilometer780.bsky.social,Kilometer780 (aka mattingham),"Wait until HS2 arrives. You won’t have to worry about holiday engineering works on the West Coast, because the south end is in such a state that long blocks will be necessary. That’s the direction that engineering works will take in future - it’ll piss off commuters and leisure travellers!",2025-04-17T14:20:29.284Z,2025-04-17T14:20:29.486Z,0,0,0,True,HS2
at://did:plc:tlppblde3jnnenadglivwszw/app.bsky.feed.post/3lmzbvd6tls27,welladriansays.bsky.social,,"The intention to build those homes isn’t there, or they are selling off an industry producing a product that’s going to be in high demand. As it is for HS2.",2025-04-17T14:10:25.299Z,2025-04-17T14:10:25.980Z,0,0,0,False,HS2
at://did:plc:oqjzprmzboh2s7jlakyeoxnl/app.bsky.feed.post/3lmz6lt6thu2j,stratfordtownfc.bsky.social,STRATFORD TOWN FOOTBALL CLUB,"THIS WEEKEND
Please be aware of the full closure  of the A46 for three weeks from Friday this weekend. Please  plan an appropriate route this weekend.  #HS2",2025-04-17T13:11:25.264Z,2025-04-17T13:11:25.385Z,0,0,0,True,HS2
at://did:plc:z23xyfkzsfpl672btrwh4t2w/app.bsky.feed.post/3lmz43mbube2i,oxford-by-otis.bsky.social,Oxford by Otis,HS2’s northwest London portal designed to eliminate sonic booms from high speed trains,2025-04-17T12:26:33.457Z,2025-04-17T12:26:35.577Z,0,0,0,True,HS2
at://did:plc:5ptupxhftt627v67zdkux7gn/app.bsky.feed.post/3lmz2w7se7u2w,vibewire.bsky.social,VibeWire News,#Apprenticeships #HS2 #Network #RailNews,2025-04-17T12:05:38Z,2025-04-17T12:05:40.285Z,0,0,0,True,HS2
at://did:plc:yz65t656umvvrkzgvc3gu7sp/app.bsky.feed.post/3lmyy2qqlvm2j,railadvent.bsky.social,RailAdvent,500th apprentice joins HS2 construction partner https://www.railadvent.co.uk/2025/04/500th-apprentice-joins-hs2-construction-partner.html #apprenticeships #hs2 #warwickshire #WestMidlands,2025-04-17T11:14:29.426Z,2025-04-17T11:14:30.782Z,2,0,0,True,HS2
at://did:plc:k2thuqlyolyq6c52qlsqefp6/app.bsky.feed.post/3lmyudrhdik2t,krikayda.bsky.social,,"Hello to all my dear humans, Special clothing set ,the Nun (costume) #HS #HS2 #HoneySelect #HoneySelect2 #OC #ハニーセレクト2 #StudioNeoV2 #saduko #Slenderwoman #Special #Nun #costume",2025-04-17T10:07:57.501Z,2025-04-17T10:08:02.882Z,3,1,0,True,HS2
at://did:plc:xfxei4f45g5z6eeppprulqry/app.bsky.feed.post/3lmy3eg3lz22t,funkmclovin.bsky.social,Dr. Funk McLovin,i dont know anything about her really im not caught up on hs2. she seems like a control freak and she was weird about jades body. i'm alt calliope ambivalent,2025-04-17T02:40:55.706Z,2025-04-17T02:41:00.893Z,7,0,0,True,HS2
at://did:plc:tnbu54yiioqrptzkrixc3xhz/app.bsky.feed.post/3lmx4d5tlqk2z,rav-in-da-house.bsky.social,Rav,The UK with HS2 and US with their HS project. Almost indistinguishable.,2025-04-16T17:25:27.522Z,2025-04-16T17:25:28.078Z,0,0,0,True,HS2
at://did:plc:d5b7mvfb42ux2d6nsxaurxp3/app.bsky.feed.post/3lmwzgcephs2r,chipper60.bsky.social,Chipper60🏴󠁧󠁢󠁳󠁣󠁴󠁿🏴󠁧󠁢󠁳󠁣󠁴󠁿🏴󠁧󠁢󠁳󠁣󠁴󠁿🏴󠁧󠁢󠁳󠁣󠁴󠁿,"World's largest elite corrupt evil criminal gang,lording it up in londongradstan ,the worlds biggest money laundering cesspit and tax haven,the easiest gravy train known to man,Tories,Tr&Trace,PPEVIP,HS2,HINKLEY,GREENSILL,Austerity,£265bn lost every yr,epic corruption,with impunity,tax havens FULL",2025-04-16T16:33:31.715Z,2025-04-16T16:33:33.082Z,3,1,0,True,HS2
at://did:plc:ygmevfdtkfch4crz3me46vdq/app.bsky.feed.post/3lmwuxfbotk2o,benbudd.bsky.social,,"Yes I’d agree with that. I think it all just needs to come together. A lot of the other rail projects up and down the UK rely upon major projects like HS2 in their assumptions for how they’re going to function, so when the rug gets pulled it sets back the entire programme",2025-04-16T15:13:36.478Z,2025-04-16T15:13:37.388Z,0,0,0,False,HS2
at://did:plc:sywnwc3uhgwgu4qbennu2uk7/app.bsky.feed.post/3lmwt7twqs226,dbrown101.bsky.social,,"It is only allocated UK spending where the spending benefits Scotland, so it pays for defence, pensions, embassies or DVLA, but not for HS2, Crossrail or some of the other things nationalists often claim.",2025-04-16T14:42:32.801Z,2025-04-16T14:42:33.190Z,1,0,0,False,HS2
at://did:plc:cl6wfbnm42fljlihxbpirgpt/app.bsky.feed.post/3lmwlwtqah22e,werahobhouse.org.uk,Wera Hobhouse MP,"Easter rail works update 🚆🐣

Track upgrades and HS2 prep will affect services to and from London Paddington from 18–21 April.

Expect reduced GWR, Heathrow Express & Elizabeth Line services.

Check before you travel 👉 www.gwr.com/check",2025-04-16T12:32:14.405Z,2025-04-16T12:32:14.982Z,3,0,0,True,HS2
at://did:plc:k2thuqlyolyq6c52qlsqefp6/app.bsky.feed.post/3lmwjviwd6s2n,krikayda.bsky.social,,"Hello to all my dear humans, Special clothing set Lingerie  #HS #HS2 #HoneySelect #HoneySelect2 #OC #ハニーセレクト2 #StudioNeoV2 #saduko #Slenderwoman #Special #Sexy #Lingerie",2025-04-16T11:55:41.932Z,2025-04-16T11:55:46.681Z,1,0,0,True,HS2
at://did:plc:crb2e2pnwgtgiorwx6ydcyhb/app.bsky.feed.post/3lmwe2pomu22x,railfocus.bsky.social,Rail Focus - Chris 🏳️‍🌈,#HS2 Meet London's tunnelling miners www.bbc.co.uk/news/article...,2025-04-16T10:11:14.441Z,2025-04-16T10:11:23.085Z,10,4,0,True,HS2
at://did:plc:ygmevfdtkfch4crz3me46vdq/app.bsky.feed.post/3lmwa5mhjzk2s,benbudd.bsky.social,,"I like this article but I did think they undermined themselves by not understanding the fundamental purpose of HS2 which is to create capacity, not cut 20 minutes off the travel time. The name HS2 has completely screwed public opinion of the project",2025-04-16T09:01:16.759Z,2025-04-16T09:01:17.981Z,3,0,1,False,HS2
at://did:plc:5hca3rb34xvfdvf2gy6neiuv/app.bsky.feed.post/3lmw7g3z4b22b,brynleyheaven.bsky.social,Brynley Heaven,'I'll see you on HS2',2025-04-16T08:48:07.755Z,2025-04-16T08:48:07.881Z,0,0,0,False,HS2
at://did:plc:5hca3rb34xvfdvf2gy6neiuv/app.bsky.feed.post/3lmw6ku5dc22b,brynleyheaven.bsky.social,Brynley Heaven,this is very good and applies to HS2,2025-04-16T08:32:53.536Z,2025-04-16T08:32:53.979Z,1,2,2,False,HS2
at://did:plc:gfgp26e475sd2rbyvacdv2qc/app.bsky.feed.post/3lmw4zjiq222v,trufflehog.bsky.social,Rote Nase Reindeer Fraktion,"No HS2, 50% rise in bus fares, and the Great British Driver gets another treat. 

This is maybe the dumbest, pettiest thing I've seen yet. Why are they like this?",2025-04-16T08:05:18.190Z,2025-04-16T08:05:20.483Z,373,95,34,True,HS2
at://did:plc:xv2drpogyy6gf4p4bqtm7s5n/app.bsky.feed.post/3lmw3rcemj226,magicharem.bsky.social,Magic Harem VS Cyberpunk Girls,"Getting the final details with the new character!
#3DCG #HoneySelect #HS2 #StoryDriven #InteractiveFiction #GameArt #renpy #AdultVisualNovel #NSFWGames #Lewdgames  #AdultGaming",2025-04-16T07:42:48.524Z,2025-04-16T07:42:51.880Z,1,0,0,True,HS2
at://did:plc:df2xn5q3w7cevkrrhprpyhk6/app.bsky.feed.post/3lmw2t6g4mk2v,pglux.bsky.social,,"Had HS2 been routed close to the M1, we could have dreamt of Eurostar charters Bedford - MLV - Futuroscope 🤡🤡🤡

#CrossChannelRail for theme parks
@jonworth.eu 

www.linternaute.com/voyage/europ...",2025-04-16T07:25:57.768Z,2025-04-16T07:26:03.180Z,0,0,0,True,HS2
at://did:plc:xdpxyybtmmragq6kobtprfql/app.bsky.feed.post/3lmvzbzvdxs2d,seb2024.bsky.social,Seb Berry 🇺🇦,"Good luck today to Wendover PC, Wendover HS2 MAG, Dobbins lane residents group. All speaking at Bucks Council against #HS2 's outrageous new scheme to send HGVs and over 2,000 other vehicle movements through the centre of #Wendover. This should have been seen off at pre-planning application phase",2025-04-16T06:58:28.824Z,2025-04-16T06:58:38.581Z,3,0,0,True,HS2
at://did:plc:rjyqmstlhbvbh6jc34d2gc6p/app.bsky.feed.post/3lmvz6ay2lk2v,dasmunch.bsky.social,"Doug, Persisting","This is why the ‘45 minutes from Birmingham to London!’ sales pitch for HS2 was nonsense. You won’t get the blue chip clients to move, no amount of economic arguments, no amount of regeneration bribes, because they simply don’t want to leave the capital and its attractions",2025-04-16T06:56:22.079Z,2025-04-16T06:56:23.577Z,3,0,1,False,HS2
at://did:plc:vl3bw4s4stwqdnfbkzgb634s/app.bsky.feed.post/3lmvykoyqn22h,ajynwa97.bsky.social,AJynwa🧣👊🏼🔴,This is awful and so sad it does my head in . Hs2 nearly killed me with all the damage they did 😢😭,2025-04-16T06:45:25.693Z,2025-04-16T06:45:26.781Z,1,0,1,False,HS2
at://did:plc:ntlt7tq7poafy22jkms4rxgz/app.bsky.feed.post/3lmvkric4xs2v,lowbudgetprod.bsky.social,Low Budget Productions,"#HS #HS2 #HoneySelect #HoneySelect2 Testing out a comic format. I present to you, Beat City Business Part 1! (Well, if it gets traction its part 1...)",2025-04-16T02:38:41.034Z,2025-04-16T02:38:46.788Z,2,1,1,True,HS2
at://did:plc:2a3gtt3mcci5slzgposmkjdc/app.bsky.feed.post/3lmuygajboc2r,davekatsucks.bsky.social,Davekat Sucks,Nice to know that Karkat was fine with the rape scene between Jane and Jake in Candy Timeline. #Homestuck #HS2 #HomestuckBeyondCanon #HSBC #BeyondCanon #Karkat #KarkatVantas,2025-04-15T21:10:16.548Z,2025-04-15T21:10:19.282Z,0,0,0,True,HS2
at://did:plc:ia5sh7mpwby75kys3disxma7/app.bsky.feed.post/3lmuvnykzx22m,matt-the-mutt.bsky.social,Matt-the-mutt,Wow those HS2 platforms looking 🔥,2025-04-15T20:20:55.429Z,2025-04-15T20:20:56.081Z,0,0,0,False,HS2
