uri,author,author_name,text,created_at,indexed_at,likes,reposts,replies,has_media,keyword
at://did:plc:ukmxhgjayjim5yjp5fbq7hqa/app.bsky.feed.post/3lmphuv2bvc23,growse.com,growse,"Ah, but you see, HS2 does nothing for the good people of Great Yarmouth or Wells so it's obviously a giant waste of money.",2025-04-13T16:30:55.536Z,2025-04-13T16:30:54.485Z,1,0,1,False,HS2
at://did:plc:jtqzekkbpewe6x7nvu5dwowa/app.bsky.feed.post/3lmphqutukc23,sciencenotopinion.bsky.social,Science is not an Opinion,"What is your source? Mine is the government's own strategic case for #HS2

The 'new destinations' is on the WCML, when they free up capacity by moving services to #HS2",2025-04-13T16:28:41.108Z,2025-04-13T16:28:41.778Z,0,0,1,False,HS2
at://did:plc:ukmxhgjayjim5yjp5fbq7hqa/app.bsky.feed.post/3lmphi3hb3k23,growse.com,growse,"Which trains, which carriages, and which platforms?

*Specifics*?

> HS2 isn't connecting any new destinations 

It's also not curing cancer, nor delivering free food to all. But it wasn't designed to do those things either.",2025-04-13T16:23:46.040Z,2025-04-13T16:23:44.881Z,1,1,0,False,HS2
at://did:plc:qd76ectaj4tbnvtjxq7yp4qo/app.bsky.feed.post/3lmphah55fk2b,daver16.bsky.social,,"60bn is more than enough to address the current issues. Trains can be made longer, carriages designed to carry more people, platforms extended. 

HS2 isn’t connecting any new destinations",2025-04-13T16:19:29.862Z,2025-04-13T16:19:30.789Z,0,0,2,False,HS2
at://did:plc:ps5k4yr3whjikynfh24ks662/app.bsky.feed.post/3lmpfx7k2sw2j,jaxyacks.com,Jackie's Podcasts+,"Oh hell yeah a fun facts section based on data analysis! They said they might do more in the future and I hope they do -- it's neat shit!
Tumblr users being ""by far the oldest cohort of fans"" is so cool!
Liking the epilogues makes you more likely to like hs2 makes sense
31/34",2025-04-13T15:56:25.155Z,2025-04-13T15:56:22.845Z,0,0,1,False,HS2
at://did:plc:ps5k4yr3whjikynfh24ks662/app.bsky.feed.post/3lmpfx7jztj2j,jaxyacks.com,Jackie's Podcasts+,"To the people who haven't heard of the Epilogues, HS2, or PQ: *insert God I wish that were me meme* /silly
Don't worry, y'all, once we're done with Homestuck, we'll be going to the Epilogues! (With a Problem Sleuth break in between)
I haven't perused PS, Psycholonials, and dropped hs2.
25/34",2025-04-13T15:56:25.149Z,2025-04-13T15:56:22.709Z,0,0,1,False,HS2
at://did:plc:7jfydiga7w7qb544pt74wwhy/app.bsky.feed.post/3lmpd4ex56s2w,luluzonite.bsky.social,"scio, sweetheart",and like. it wasnt just Other Fans it was OFTEN people involved in the official works being released. whole chunks of pq and early hs2 that just do not scan unless you were aware what the author had been yelling wt people about on twitter during that time,2025-04-13T15:05:38.368Z,2025-04-13T15:05:39.016Z,7,0,2,False,HS2
at://did:plc:od736zk4jzdweguvsg2mcwxw/app.bsky.feed.post/3lmp7uveqsp2m,some-rss-feeds.bsky.social,,"[some-subscribed-rss] New Post: Making the Euston HS2 Build Viable, by andrew lainton https://andrewlainton.wordpress.com/2025/04/13/making-the-euston-hs2-build-viable/",2025-04-13T14:07:45.836735553Z,2025-04-13T14:07:46.482Z,0,0,0,False,HS2
at://did:plc:vj5bycgsbhpvebhty4dpjsq7/app.bsky.feed.post/3lmp22earnc26,davidburley.bsky.social,,I assume Universal Bedford will be on the HS2 line.,2025-04-13T12:23:26.855Z,2025-04-13T12:23:26.882Z,0,0,0,False,HS2
at://did:plc:lbjfv33xguwjbaypdo3bi5jn/app.bsky.feed.post/3lmozhs3cy224,hardhatalex.bsky.social,Alex Romankiw 🇺🇦,"2hr+ delays on the M1 at J18, due to a scheduled closure for waterproofing works - on the same weekend the A46 at Stoneleigh is closed for HS2. Can we have some coordination between regions please, this is ridiculous",2025-04-13T12:13:03.826Z,2025-04-13T12:13:04.787Z,0,0,0,False,HS2
at://did:plc:oeeoj6dzj4xe66uwadbkqwr2/app.bsky.feed.post/3lmonrzvghk2c,yorkiesteak.bsky.social,RichyRich,1/ Yeah the skew of funding across the country is very poor. Big example HS2 was cancelled N of Bmghm. That WAS the big infrastructure investment in the N to free up capacity on railway lines and roads across the region & of course N/S thru capacity.,2025-04-13T08:44:02.665Z,2025-04-13T08:44:05.780Z,2,0,1,False,HS2
at://did:plc:mkhjvd5flljqdjyqz3kbmsn6/app.bsky.feed.post/3lmokyg75xc2r,gazza-d.bsky.social,Real Gaz on a proper bike: gazza_d@toot.bike,"I've voted for @greenparty.org.uk for a good few years.
Because of public stances by some of their very public figures against HS2, pylons for green energy schemes, and now endangering active travel users over bus stop bypasses, I am seriously reconsidering.",2025-04-13T07:53:55.672Z,2025-04-13T07:53:56.180Z,48,3,12,False,HS2
at://did:plc:z23xyfkzsfpl672btrwh4t2w/app.bsky.feed.post/3lmois2segp2g,oxford-by-otis.bsky.social,Oxford by Otis,"Second HS2 tunnel reaches Greenford, completing Western Northolt tunnel",2025-04-13T07:14:34.656Z,2025-04-13T07:14:36.080Z,0,0,0,True,HS2
at://did:plc:twfwry2bfrzo5czgpsp5yszr/app.bsky.feed.post/3lmofyf5kus27,caiwoganjones.bsky.social,Cai Wogan Jones,"Wales:
👊screwed on #HS2 £4bn
👊screwed on Barnet funding reform
👊screwed on PT blast furnaces
👊screwed on Crown Estate revenues ...
... it goes on and on ...",2025-04-13T06:24:25.860Z,2025-04-13T06:24:26.877Z,6,0,1,False,HS2
at://did:plc:kepsfj6auoq2nffomsuqqv2f/app.bsky.feed.post/3lmnzs3fi222u,pete-wells.bsky.social,Peter Wells,"So let me get this right:

crossrail - demand massively above expectations 

Northumberland line - demand massively above expectations 

HS2 - nah who would want that 🤦‍♂️🤦‍♂️🤦‍♂️",2025-04-13T02:46:09.408Z,2025-04-13T02:46:10.384Z,5,1,0,False,HS2
at://did:plc:k2thuqlyolyq6c52qlsqefp6/app.bsky.feed.post/3lmnywjkdds2q,krikayda.bsky.social,,"Alt Special clothing set ,the Kimono (No mask) #HS #HS2 #HoneySelect #HoneySelect2 #OC #ハニーセレクト2 #StudioNeoV2 #saduko #Slenderwoman #Special #kimono #japan",2025-04-13T02:30:44.582Z,2025-04-13T02:30:47.983Z,1,0,0,True,HS2
at://did:plc:k2thuqlyolyq6c52qlsqefp6/app.bsky.feed.post/3lmnytx5ams2q,krikayda.bsky.social,,"Hello to all my dear humans, Special clothing set ,the Kimono (for me) #HS #HS2 #HoneySelect #HoneySelect2 #OC #ハニーセレクト2 #StudioNeoV2 #saduko #Slenderwoman #Special #kimono #japan",2025-04-13T02:29:18.173Z,2025-04-13T02:29:22.183Z,1,0,0,True,HS2
at://did:plc:kepsfj6auoq2nffomsuqqv2f/app.bsky.feed.post/3lmnps6m7f22u,pete-wells.bsky.social,Peter Wells,I had the temerity to point out HS2 wasn’t just to get to Birmingham 20min quicker (I was very polite and factual in pointing out why this was BS) and I was rewarded with a block too. I wonder to this day if she still believes trains can’t go round corners…,2025-04-12T23:47:15.357Z,2025-04-12T23:47:16.682Z,1,0,0,False,HS2
at://did:plc:kepsfj6auoq2nffomsuqqv2f/app.bsky.feed.post/3lmnoocpl2c2u,pete-wells.bsky.social,Peter Wells,"See also her pro-Brexit and anti-HS2 stances, where her rhetoric completely aligns with the opaquely funded Tufton St lobbyists…",2025-04-12T23:27:11.702Z,2025-04-12T23:27:12.779Z,3,0,0,False,HS2
at://did:plc:kepsfj6auoq2nffomsuqqv2f/app.bsky.feed.post/3lmnofs54v22u,pete-wells.bsky.social,Peter Wells,I’m not surprised. She was against HS2 because “trains can’t go round corners”…,2025-04-12T23:22:25.884Z,2025-04-12T23:22:26.486Z,2,0,0,False,HS2
at://did:plc:gyi5sbqd4xqdmdupipzm62k6/app.bsky.feed.post/3lmnlpedryc2x,baysen-chesney.bsky.social,ЯMZ,Enjoying a night out in the club #HS2 #HoneySelect #3DCG #nsfw,2025-04-12T22:34:05.737Z,2025-04-12T22:34:08.085Z,2,1,0,True,HS2
at://did:plc:bffqlve2xx5s2wkwtqtxk4vh/app.bsky.feed.post/3lmnl26tu6c2c,theenglishlendo.bsky.social,TheEnglishLendo,Hello guys i litrely made a map about HS2 and HS1(Eurostar) and Cailedeonian Sleeper. Here is the map. #aritist and #transport.,2025-04-12T22:22:15.328Z,2025-04-12T22:22:18.581Z,0,0,0,True,HS2
at://did:plc:rk3gka5pgbltn7btij6oun62/app.bsky.feed.post/3lmnhrzoypk2q,faultfinderuk.bsky.social,"It’s me, Claire","To remodernise British steel £6bn 
HS2 likely to cost over £80bn

Let’s own our steel industry, and make it a success. Surely for a start there’s some rollercoasters in Bedford to make.",2025-04-12T21:24:00.264Z,2025-04-12T21:24:00.576Z,0,0,0,False,HS2
at://did:plc:bvb77r4oy3ebtxouh3ej3ayy/app.bsky.feed.post/3lmnf3qvly22f,iwanafallon.bsky.social,Iwan ap Dafydd,problem is this is just another example of how Labour treats Wales - HS2 money - we do get Barnet consequentials and devolving the Crown Estate.....,2025-04-12T20:35:45.366Z,2025-04-12T20:35:46.088Z,0,0,1,False,HS2
at://did:plc:sywnwc3uhgwgu4qbennu2uk7/app.bsky.feed.post/3lmnbzw6im22t,dbrown101.bsky.social,,"The Scottish Government is allowed a deficit, but more mportantly, the Scottish Government is not Scotland.

Scotland doesn't pay for HS2.",2025-04-12T19:41:02.568Z,2025-04-12T19:41:03.483Z,1,0,0,False,HS2
at://did:plc:zxpdohvxgex4crhndqgvpepd/app.bsky.feed.post/3lmn6arqnsk23,petersquires.bsky.social,Fat Freddie's Cat,"It always seems to be different for Wales, doesn't it? HS2 for starters.",2025-04-12T18:33:17.831Z,2025-04-12T18:33:22.684Z,3,0,0,False,HS2
at://did:plc:cbakeftx337dvdsrsxevrrfz/app.bsky.feed.post/3lmn4pbvkgk2y,thetecheng.bsky.social,Nick Peterson,HS2 giving California HSR a run for title of never ending black hole of money for ever decreasing returns.,2025-04-12T18:05:37.051Z,2025-04-12T18:05:37.483Z,3,0,0,False,HS2
at://did:plc:y2ur5uc55itgipwkaldudmiv/app.bsky.feed.post/3lmmwwoqkp22v,theblackstray.bsky.social,🔞The Black Stray🔞,"HS2 Com for @percivalwiles.bsky.social ,

Femboy Photoshoot

#honeyselect #honeyselect2 #R18 #3dart #nsfw #3dcg",2025-04-12T16:22:22.689Z,2025-04-12T16:24:14.987Z,5,2,1,True,HS2
at://did:plc:pg25xdfcd6pdsnou4ah5osqj/app.bsky.feed.post/3lmmtquul7s2e,dt-technician.bsky.social,Mark Dabee Saltmarsh,"Been a Labour support most of my life, I’m done. Give us Plaid and a say in our own future, tired of Westminster treating us like second class citizens, every single time. From HS2, the crown estate, port talbot and on and on and on.",2025-04-12T15:25:26.820Z,2025-04-12T15:25:27.484Z,21,0,1,False,HS2
at://did:plc:mkhjvd5flljqdjyqz3kbmsn6/app.bsky.feed.post/3lmmqsjq3mc25,gazza-d.bsky.social,Real Gaz on a proper bike: gazza_d@toot.bike,"It's really frustrating how they lap up the spin from the likes of the Telegraph instead of following the evidence and facts. We have the Tories and reform for that bollocks.
- HS2.
-Pylons.
- bus stop bypasses.
And there will be other examples.",2025-04-12T14:32:41.016Z,2025-04-12T14:32:41.880Z,1,0,0,False,HS2
at://did:plc:pgm2q4fk6c7hwxpro6plgtii/app.bsky.feed.post/3lmmqqartd22i,clusterblock.bsky.social,Cluster Block🌈 🍉,"Conservatives want hierarchy.

Socialists want equality.

Environmentalists mostly want to go ‘back to nature’ (and so often are against e.g. HS2 and nuclear power, because although they save carbon they are unnatural and hence bad).

That’s a separate thing to socialism.",2025-04-12T14:31:24.533Z,2025-04-12T14:31:25.878Z,1,0,0,False,HS2
at://did:plc:z5p55foejrophk37unkljwts/app.bsky.feed.post/3lmmms6vusc2j,steperrin.bsky.social,Stephen Perrin,"Trans rights; HS2; ""Bre*it"", she seems to be on the wrong side of every progressive issue going. Tried to make light of Sarah Everard's murder by ""not entirely serious[ly]"" proposing a male curfew.

But she likes trees so that's OK. And the Green Party tolerates it. So sod them.",2025-04-12T13:20:54.710Z,2025-04-12T13:20:55.678Z,8,1,1,False,HS2
at://did:plc:75kb723d7zm4jd7agg3bv4ve/app.bsky.feed.post/3lmmmf6y2qc2l,markportis.bsky.social,Mark 🏴󠁧󠁢󠁷󠁬󠁳󠁿,"Oh how badly English Labour let Wales down, ignore Port Talbot, refuse to devolve the crown estate, refuse to compensate us for HS2, they won't even let us have a public holiday on St Davids day. Baroness Morgan will have some groveling to do on Monday in the Senedd
#annibyniaeth",2025-04-12T13:13:38.574Z,2025-04-12T13:13:39.987Z,4,0,1,False,HS2
at://did:plc:62rcxn422zplitlwlc5dhqyo/app.bsky.feed.post/3lmmlbf2g6i2o,clawson.club,Hammel Hazan,"""Cooking a new one! I thought Rishi cancelled HS2 and put all the time you can’t do this picture of the Old MacBook Pro"" as Rev L. Sumsip said",2025-04-12T12:53:36.601042+00:00,2025-04-12T12:53:37.877Z,0,0,0,False,HS2
at://did:plc:up3bfaowquby7eup7u2yuhw5/app.bsky.feed.post/3lmml6xd5as2b,llyfrgellbabel.bsky.social,DDOwen ,"Tbh, between this, HS2, the imminent collapse of major local employers (universities) and Reeves not properly funding Welsh public sector NI support, we've got a fair bit to be bitter about.",2025-04-12T12:52:15.480Z,2025-04-12T12:52:15.684Z,2,0,1,False,HS2
at://did:plc:imbtnp4u6ynafrut6bqsixfz/app.bsky.feed.post/3lmmis5jm3s2j,frankieboy1964.bsky.social,Frank,"Where's the Diamond Encrusted Rails for HS2, at £80Bn they must be?",2025-04-12T12:09:18.292Z,2025-04-12T12:09:19.077Z,0,0,0,False,HS2
at://did:plc:ixoayjbdmexmbgoaq74ao5hq/app.bsky.feed.post/3lmmgsv3cvc2r,seymourstrangely.bsky.social,Seymour Strangely,"fortunately UKGov has never wasted a penny on any procurements, like HS2 or aircraft carriers, for example..",2025-04-12T11:33:55.506Z,2025-04-12T11:33:57.180Z,3,0,1,False,HS2
at://did:plc:ooiqlf2ipvkxc25f2tvqa2ma/app.bsky.feed.post/3lmmdja3afs2r,cymrojazz.bsky.social,Gwyn Ap Nudd,"What's going on?
First, let's define ""Britishness"" (see img). 
And there's the pattern- 
""Labour in 🏴󠁧󠁢󠁷󠁬󠁳󠁿""
* refuse to demand full HS2 consequential funding
* refuse to ""devolve"" crown👑 estate income (£ goes to UK treasury & does not come back)
* and now it's only ""British"" steel when it's in England",2025-04-12T10:34:50.225Z,2025-04-12T10:34:50.984Z,1,0,0,True,HS2
at://did:plc:jz5ft6rqczyfntjfgqep2ugh/app.bsky.feed.post/3lmmdivhwyc23,xtrahand1.bsky.social,,"Everybody around the world thinks high speed train travel is a must , one exception the UK With HS2",2025-04-12T10:34:39.150Z,2025-04-12T10:34:40.379Z,2,0,0,False,HS2
at://did:plc:4hm6gb7dzobynqrpypif3dck/app.bsky.feed.post/3lmm7ekzld724,news-feed.bsky.social,News Feed,"@Telegraph: 💸 Taxpayer ‘risks footing £6bn bill for HS2 Euston overhaul’
",2025-04-12T09:20:38.921Z,2025-04-12T09:20:39.178Z,0,0,0,True,HS2
at://did:plc:oqjzprmzboh2s7jlakyeoxnl/app.bsky.feed.post/3lmm6bhvpc62m,stratfordtownfc.bsky.social,STRATFORD TOWN FOOTBALL CLUB,"THIS WEEKEND
Please be aware of the full closure  of the A46 for three weeks from Friday this weekend. @StamfordAFC1896  #HS2",2025-04-12T09:01:01.290Z,2025-04-12T09:01:01.878Z,0,0,0,True,HS2
at://did:plc:wayxz4o5y4xfxfkckdumx7tz/app.bsky.feed.post/3lmm4y7yygc2j,geoffrey-kolbe-01.bsky.social,Geoffrey Kolbe,Is that a monument to HS2?,2025-04-12T08:37:57.317Z,2025-04-12T08:37:59.683Z,1,0,1,False,HS2
at://did:plc:5ptupxhftt627v67zdkux7gn/app.bsky.feed.post/3lmm4wwfe742u,vibewire.bsky.social,VibeWire News,#Buckinghamshire #HS2 #Infrastructure #RailNews,2025-04-12T08:37:13Z,2025-04-12T08:37:14.579Z,0,0,0,True,HS2
at://did:plc:2evr2kjdczwum2kxppb6m4bo/app.bsky.feed.post/3lmm3oi3ynk2g,indystitcher.bsky.social,Indystitcher 🏴󠁧󠁢󠁳󠁣󠁴󠁿,"The Scottish government doesn’t have a deficit, they’re not allowed to have one. The ‘deficit’ is what the UK government deems as Scotlands share, you know projects like HS2. You need stop getting your information from MSM, look at the facts. Btw education system is fine (more MSM misinformation)",2025-04-12T08:14:36.518Z,2025-04-12T08:14:37.378Z,1,0,2,False,HS2
at://did:plc:2qsofv3zq265ifnmvzaned6j/app.bsky.feed.post/3lmlzy4mfcc2q,r-e-e-v-o.bsky.social,,"@mrjamesob.bsky.social so , there is consternation that Scunthorpe might need 6 billion to revive/un privatise  an industry we directly badly need for many reasons now , and yet 50billion for HS2 is some how ok for a vanity project with no nationwide benifit? #britishsteel #scunthorpe",2025-04-12T07:44:12.530Z,2025-04-12T07:44:13.877Z,0,0,0,False,HS2
at://did:plc:yz65t656umvvrkzgvc3gu7sp/app.bsky.feed.post/3lmlzv6hoan2x,railadvent.bsky.social,RailAdvent,Special design avoids ‘sonic boom’ at HS2 tunnel https://www.railadvent.co.uk/2025/04/special-design-avoids-sonic-boom-at-hs2-tunnel.html #buckinghamshire #hs2,2025-04-12T07:42:33.383Z,2025-04-12T07:42:34.683Z,1,0,0,True,HS2
at://did:plc:gisoiljbzanntmzu47xumgbz/app.bsky.feed.post/3lmlyaahiws2k,davidcox65.bsky.social,Dave Cox,Meanwhile HS2 is doing what?,2025-04-12T07:12:57.519Z,2025-04-12T07:12:58.482Z,6,1,1,True,HS2
at://did:plc:5ceiw3yxm2dfypvv2lod3a7d/app.bsky.feed.post/3lmlwjman2s2w,rcgarrioch.bsky.social,Rachel Garrick,"Very hard to disagree with this sentiment. UK Labour is giving me huge concerns over its position on HS2, Crown Estate and Steel. Wales appears to be second class at every turn and it  challenges my ability to  represent the party.",2025-04-12T06:42:24.384Z,2025-04-12T06:42:25.476Z,2,0,0,True,HS2
at://did:plc:g2fef4qdlznd4h6lyedjqtgf/app.bsky.feed.post/3lmlvcsckxs2a,planningtransport.co.uk,Steve Chambers,If Crossrail teaches us anything it is do not commit to a date. www.newcivilengineer.com/latest/hs2-c...,2025-04-12T06:20:42.113Z,2025-04-12T06:20:42.582Z,13,0,4,True,HS2
at://did:plc:mcxd6fu5ps77jqv5ybejhpto/app.bsky.feed.post/3lmkzfzysn22v,arguablyari.bsky.social,ari 🌊,why do random reddit replies cook so hard,2025-04-11T22:01:26.077Z,2025-04-11T22:01:25.980Z,5,0,2,True,HS2
at://did:plc:dlrtomfvbczar3pktyazzj7i/app.bsky.feed.post/3lmku36t7w22y,elgobsucram.bsky.social,Marcus,It's... A little bit funny that the middle of the country... Bedford... is getting a series of roller-coasters but HS2 was cancelled when it was half dug out.,2025-04-11T20:25:53.325Z,2025-04-11T20:25:54.376Z,0,0,0,False,HS2
at://did:plc:3u4pur3gzyum4wqjqfsookzn/app.bsky.feed.post/3lmktxfkeg22n,heavenstobetsie.bsky.social,Debbie M but with a santa hat on,"Michael Fabricant giving a speech about HS2 while in the Big Brother house, he's not really going for the target audience, is he? #CBB",2025-04-11T20:23:46.161Z,2025-04-11T20:23:46.476Z,4,0,0,False,HS2
at://did:plc:lbksarm3ccb5ofhxmcd47qxs/app.bsky.feed.post/3lmksioqslk27,lukeejames2.bsky.social,Luke James,"The UK Government’s record on Wales in its first year in office: 

- Refused to nationalise Port Talbot 
- Opposing devolution of Crown Estate 
- No share of HS2 spending 
- No fairer funding formula 
- Welfare cuts that will disproportionately hit Wales",2025-04-11T19:57:38.750Z,2025-04-11T19:57:39.083Z,6,7,2,False,HS2
at://did:plc:n7fyohc33r2yxyv7of3bqdx3/app.bsky.feed.post/3lmkmtfyc7k2t,scrabster.bsky.social,,"The guy at the centre of Covid fraud, HS2 fraud. Does this mean he is afforded immunity?",2025-04-11T18:16:16.206Z,2025-04-11T18:16:16.883Z,0,0,0,False,HS2
at://did:plc:vv6sodi4lmn3w43op3nbh2wj/app.bsky.feed.post/3lmkfaj3qsk2b,jonbarnes.bsky.social,Jon Barnes,"HS2
Crown Estate
Steel

It's one rule for them, and another for us.

But we only had to wait for Labour to be in power in Wales and Westminster we were all told. Then it would be milk and honey. True colours.",2025-04-11T16:00:25.735Z,2025-04-11T16:00:26.783Z,0,0,0,False,HS2
at://did:plc:bmvbevyymawntv4ejwfitvm6/app.bsky.feed.post/3lmkenu37422c,iwanwills.bsky.social,Iwan Williams,"Safonau dwbl Llafur ar hyn. Achub Scunthorpe ond geith Port Talbot farw? Rhwng hyn,HS2 a Stad y Goron,ddim yn deall apêl Llafur yn 🏴󠁧󠁢󠁷󠁬󠁳󠁿 / Labour’s double standards on this.Save Scunthorpe but Port Talbot can die? Between this,HS2 £4Bn,devoblocking & Crown Estate,don’t understand Labour’s appeal in 🏴󠁧󠁢󠁷󠁬󠁳󠁿 🤷🏻‍♂️",2025-04-11T15:49:59.720Z,2025-04-11T15:50:00.478Z,12,7,0,True,HS2
at://did:plc:z5odscoo7aonhyroy52aycmx/app.bsky.feed.post/3lmkendc5kk2q,bucksblackcat.bsky.social,Bucks Blackcat,"@nationalhighways.bsky.social For the love of God put some signs in A4421 from Bicester to Finmere telling people to go a different way, til the HS2 works are done. Did about half a mile in 40 mins then had to turn round and go back!!!",2025-04-11T15:49:42.117Z,2025-04-11T15:49:43.886Z,1,0,0,True,HS2
at://did:plc:3s4k5hm6utqh4t3jolwsjc4x/app.bsky.feed.post/3lmkdknwhym2u,social.newcivilengineer.com,New Civil Engineer,"Resetting the HS2 programme to bring its costs back into control is a “solvable” challenge, but it is unclear when services will commence, HS2 Ltd chief executive Mark Wild has admitted

Full story:",2025-04-11T15:30:17.946Z,2025-04-11T15:30:19.589Z,0,0,0,True,HS2
at://did:plc:3s4k5hm6utqh4t3jolwsjc4x/app.bsky.feed.post/3lmka7lgtid2a,social.newcivilengineer.com,New Civil Engineer,"HS2 engineers have finalised work on innovative extensions to the Chiltern tunnel southern portals designed to mitigate sonic booms produced by trains entering and exiting at high speeds

Full story:",2025-04-11T14:30:24.946Z,2025-04-11T14:30:26.684Z,1,0,0,True,HS2
at://did:plc:tt4fffh6xo57mz64vyofkfjv/app.bsky.feed.post/3lmk4mxdtr22k,matthewllthomas.bsky.social,🎄🎅🏻❄️🎁 Matt-y Christmas 🎁❄️🎅🏻🎄,Reinstate HS2 using cheap nationalised British steel 😈,2025-04-11T13:26:19.653Z,2025-04-11T13:26:23.381Z,1,1,0,True,HS2
at://did:plc:d5b7mvfb42ux2d6nsxaurxp3/app.bsky.feed.post/3lmk345ks522e,chipper60.bsky.social,Chipper60🏴󠁧󠁢󠁳󠁣󠁴󠁿🏴󠁧󠁢󠁳󠁣󠁴󠁿🏴󠁧󠁢󠁳󠁣󠁴󠁿🏴󠁧󠁢󠁳󠁣󠁴󠁿,"And EVERY ONE OF THEM GUILTY OF THE EPIC PPEVIP CORRUPTION,HS2,.HINKLEY,ETC ETC.100s of citizens died alone during the pigs in the trough PPEVIP lane,partygate etc,AND THIS IS WHAT THEY THINK OF YOU THE VOTERS,THE TAX PAYERS ,THEY REWARD ABJECT FAILURE AT THE POST.come on Tae fuck SCOTLAND,RUN AWAY",2025-04-11T12:59:01.998Z,2025-04-11T12:59:03.084Z,24,10,0,True,HS2
at://did:plc:xv2drpogyy6gf4p4bqtm7s5n/app.bsky.feed.post/3lmjz6ik62s2f,magicharem.bsky.social,Magic Harem VS Cyberpunk Girls,"Why do guys hair look so good on women? (new character btw)
#3DCG #HoneySelect #HS2 #StoryDriven #InteractiveFiction #GameArt #renpy #AdultVisualNovel #NSFWGames #Lewdgames  #AdultGaming",2025-04-11T12:24:33.134Z,2025-04-11T12:24:36.486Z,1,0,0,True,HS2
at://did:plc:k2thuqlyolyq6c52qlsqefp6/app.bsky.feed.post/3lmjtdkfai22r,krikayda.bsky.social,,"Hello to all my dear humans, Special clothing set ,the Cat  (Bikini Cat) #HS #HS2 #HoneySelect #HoneySelect2 #OC #ハニーセレクト2 #StudioNeoV2 #saduko #Slenderwoman #Special #cat #bikinii",2025-04-11T10:40:00.272Z,2025-04-11T10:40:04.282Z,3,0,0,True,HS2
at://did:plc:qunp2inxxbgsryu6qbhrrnmp/app.bsky.feed.post/3lmjptzjzkc2k,alexanderjbrock.bsky.social,Alexander Brock,"""Construction has been harder than we would have thought.""

HS2's boss was unable to say whether the first trains between Birmingham and London would run between 2029 and 2033 - as previously suggested",2025-04-11T09:37:38.197Z,2025-04-11T09:37:40.777Z,0,0,0,True,HS2
at://did:plc:34jz3n47bju35dl4kkzxwkmt/app.bsky.feed.post/3lmjlkeqa2s2w,radiohead319.bsky.social,Radiohead319 💙,"I also worry they are being applied unequally.  I see zero evidence of well-to-do nimby anti-hs2, solar, windfarm etc protesters getting arrested and banged-up for years.",2025-04-11T08:20:39.423Z,2025-04-11T08:20:39.280Z,0,0,0,False,HS2
at://did:plc:gmijo2b4pmywnhmralvqtqsn/app.bsky.feed.post/3lmjlaygdhk2l,ianvisits.co.uk,ianVisits,"HS2's northwest London portal designed to eliminate sonic booms from high speed trains

 ianvisits.co.uk/articles/hs2... 

HS2 has completed work on a pair of extensions to the southern portal of its longest tunnel to eliminate ‘sonic booms’ from trains entering the tunnel at up to 200mph.",2025-04-11T08:15:24.525Z,2025-04-11T08:15:25.082Z,15,2,0,True,HS2
at://did:plc:qsw4hfmuz66kxk2niwr4gpug/app.bsky.feed.post/3lmjkjc6ruk2c,odhughes.bsky.social,Owen,"The patriotic thing for #starmer to do would be to nationalise British Steel, then tomorrow announce HS2 in full. 

You just know all these people bleating on about losing a great British institution object to any/all projects that involve large scale manufacturing. 

#britishsteel",2025-04-11T08:02:09.459Z,2025-04-11T08:02:10.680Z,6,1,2,False,HS2
at://did:plc:eieucyycdvauquh54fehjba3/app.bsky.feed.post/3lminoh5ugk2o,sayno2sizewellc.bsky.social,Together Against Sizewell C,...spent on quicker to deploy renewables and other alternatives. Sizewell C is straight out of the HS2 playbook with government officials using £6bn of unrestrained expenditure to justify throwing more good money after bad. TASC is extremely disappointed that...,2025-04-10T23:26:01.670Z,2025-04-10T23:26:05.072Z,0,0,1,False,HS2
at://did:plc:n54if4znbfa4jsslgpmib6r2/app.bsky.feed.post/3lmih56w2dc2y,abelian.bsky.social,Abelian,"A number of these organisations fought tooth and nail against HS2. They won, thanks to Sunak; for my lifetime we will have more cars and HGVs instead. But yes, these people can absolutely be trusted when they sound off about ""win-win"" development.",2025-04-10T21:29:02.397Z,2025-04-10T21:29:05.782Z,0,0,0,True,HS2
at://did:plc:dottdevndkca5j72vxllp5lo/app.bsky.feed.post/3lmhzkl4r6k25,gavinsteven.bsky.social,Gavin Steven,We end up paying for the UK debt when we don’t benefit.  HS2 is a prime example.,2025-04-10T17:25:59.033Z,2025-04-10T17:25:59.886Z,7,0,0,False,HS2
at://did:plc:rhnxnd544d6kuzpeqwz5gzjx/app.bsky.feed.post/3lmhuiavz4c2k,peovereye.bsky.social,,"Starmer is a coward, he could just say we’re rejoining the EU, after all that tiny little Tory took it upon himself to cancel HS2 from Birmingham to Manchester and no one said anything.",2025-04-10T15:55:12.510Z,2025-04-10T15:55:13.486Z,6,1,1,False,HS2
at://did:plc:sveayiznrpj5grkflnxlqlpi/app.bsky.feed.post/3lmhudoqfjc2h,roguebraincell.bsky.social,,Your free trial of HS2 has ended,2025-04-10T15:52:39.220Z,2025-04-10T15:52:43.385Z,0,0,0,True,HS2
