uri,author,author_name,text,created_at,indexed_at,likes,reposts,replies,has_media,keyword
at://did:plc:k2thuqlyolyq6c52qlsqefp6/app.bsky.feed.post/3llvqcjrso22d,krikayda.bsky.social,,"Alt: Hello to all my dear humans, Special clothing set , this my version lady Krikayda (No mask) #HS #HS2 #HoneySelect #HoneySelect2 #OC #ハニーセレクト2 #StudioNeoV2 #saduko #Slenderwoman #cosplay #SpiderVerse #spiderwoman",2025-04-03T10:52:30.083Z,2025-04-03T10:52:33.001Z,4,0,0,True,HS2
at://did:plc:k2thuqlyolyq6c52qlsqefp6/app.bsky.feed.post/3llvqacx5hk2d,krikayda.bsky.social,,"Hello to all my dear humans, Special clothing set , this my version lady Krikayda (my version of his Dracula costume) #HS #HS2 #HoneySelect #HoneySelect2 #OC #ハニーセレクト2 #StudioNeoV2 #saduko #Slenderwoman #cosplay #SpiderVerse #spiderwoman",2025-04-03T10:51:15.814Z,2025-04-03T10:51:19.103Z,4,0,0,True,HS2
at://did:plc:5ptupxhftt627v67zdkux7gn/app.bsky.feed.post/3llvodjoilm2j,vibewire.bsky.social,VibeWire News,#HighSpeedRail #HS2 #IndustryNews #Infrastructure,2025-04-03T10:17:15Z,2025-04-03T10:17:17.402Z,0,0,0,True,HS2
at://did:plc:balmedvhjqy56xgdciw7u7wf/app.bsky.feed.post/3llvntewj2s2c,scottishym.bsky.social,Scottish Yorkshire Man,"Just think, if we recover these corruptions from Hancock and Goves pension pots.... Along with the cost of HS2 from that blob of lard Johnson. Pretty sure that will help with the funding of something far more important possible.",2025-04-03T10:08:14.336Z,2025-04-03T10:08:15.402Z,6,0,0,False,HS2
at://did:plc:btlivl27d3gvzzu37zfh7hzl/app.bsky.feed.post/3llviui32js26,loopylaura.bsky.social,,"Would they put such a negative spin on HS2?  Oh, wait...",2025-04-03T08:39:22.475Z,2025-04-03T08:39:22.899Z,1,1,0,True,HS2
at://did:plc:yfnemaellca64lvba3zwsaw6/app.bsky.feed.post/3llujydxkds26,nilo.bsky.social,Nilo,"They’re all built by national rail companies /infrastructure managers. Two exceptions. 

1. The Japanese have section of the ministry of land, tourism and infrastructure that builds there’s and then leases them to the RRs. 
2. The UK used a special purpose vehicle for HS2 and I think HS1",2025-04-02T23:26:46.386Z,2025-04-02T23:26:46.804Z,2,0,1,False,HS2
at://did:plc:mdd3hdxwgd5zoj5szfysjgra/app.bsky.feed.post/3lluatoojjc2u,floral-anvil.co.uk,Katie Wilson 🐇,"Inb4 these are built on land bought for HS2, further killing possibly one of the most important rail infrastructure developments in a long time",2025-04-02T20:43:06.177Z,2025-04-02T20:43:08.798Z,0,0,0,True,HS2
at://did:plc:wovrxjf4dejdzk6wu27jxnzr/app.bsky.feed.post/3llu6z7lpes25,johnlamont.bsky.social,John Lamont,And the country that invented the steam train can’t build one high speed track. #HS2 China leads the world on this transport.,2025-04-02T20:10:24.199Z,2025-04-02T20:10:24.608Z,0,0,0,True,HS2
at://did:plc:7mjc6kasoegoxhjgmk4apozt/app.bsky.feed.post/3lltrgpzfks2e,rave74.bsky.social,RV 🇸🇩 🇺🇦 🇵🇸 🇮🇳 🇬🇧,Sounds like HS2,2025-04-02T16:07:25.248Z,2025-04-02T16:07:25.598Z,9,4,0,True,HS2
at://did:plc:ra7gnka3eh7tmedipckwjbx6/app.bsky.feed.post/3lltqfo5dws2u,leftyfire77.bsky.social,Leftyfire77🇬🇧🇪🇺🇺🇲 #FBPE,"Labour should;

Rejoin the Single Market,

Realign us with the EU,

Push out private companies from the NHS,

Renationalise the Railway network (and expand it),
use the revenue to fund the expansion of HS2 all the way to Scotland.

Renationalise Water, Electricity, and Gas.",2025-04-02T15:48:55.983Z,2025-04-02T15:48:56.801Z,1,0,0,False,HS2
at://did:plc:62rcxn422zplitlwlc5dhqyo/app.bsky.feed.post/3lltmrgcxlm2e,clawson.club,Hammel Hazan,"""And I thought Rishi cancelled HS2 and corporate manslaughter is Not stop the first time in the shiny new house. Goats (and turkeys) with extreme happiness"" says Mrs G.S. Cessisski MP",2025-04-02T14:43:55.089452+00:00,2025-04-02T14:43:55.699Z,0,0,0,False,HS2
at://did:plc:bxbf23r6nnov4hwpufffvx2v/app.bsky.feed.post/3llt4vnnzbs2m,foarp.bsky.social,FOARP,"You can also looks at some of the major cases where the planning system has imposed the most eye-watering costs on those who want to build things: the £100 million ""bat tunnel"" for HS2, the £300 million cost of the planning application for the lower Thames crossing being a couple of examples.",2025-04-02T09:59:57.516Z,2025-04-02T10:00:19.500Z,0,0,0,False,HS2
at://did:plc:k2thuqlyolyq6c52qlsqefp6/app.bsky.feed.post/3llt4mlt2hc2m,krikayda.bsky.social,,"Alt: cosplay clothing set , this time it's time for a My SpiderVerse (Broken Outfit)  #HS #HS2 #HoneySelect #HoneySelect2 #OC #ハニーセレクト2 #StudioNeoV2 #saduko #Slenderwoman #cosplay #SpiderVerse #spiderwoman",2025-04-02T09:54:53.495Z,2025-04-02T09:54:56.697Z,3,0,0,True,HS2
at://did:plc:k2thuqlyolyq6c52qlsqefp6/app.bsky.feed.post/3llt4kwsu522m,krikayda.bsky.social,,"Hello to all my dear humans, cosplay clothing set , this time it's time for a My SpiderVerse (Broken Outfit)  #HS #HS2 #HoneySelect #HoneySelect2 #OC #ハニーセレクト2 #StudioNeoV2 #saduko #Slenderwoman #cosplay #SpiderVerse #spiderwoman",2025-04-02T09:53:57.908Z,2025-04-02T09:54:01.600Z,2,0,0,True,HS2
at://did:plc:mkjv7gwefp4lpje7qmvc42al/app.bsky.feed.post/3llt3rptx3b2o,ukconstructionblog.bsky.social,UK Construction Blog,"The project proposes public funding but private operations. Claims it could boost urban GDP by 7.2%. But after HS2's cost spiral from £32.7B to £100B+, can Europe avoid the same fate across multiple nations?",2025-04-02T09:39:51.743Z,2025-04-02T09:39:52.096Z,0,0,1,False,HS2
at://did:plc:mkjv7gwefp4lpje7qmvc42al/app.bsky.feed.post/3llt3rpnw5k2a,ukconstructionblog.bsky.social,UK Construction Blog,MAJOR HURDLES: 1. Technical standardization across borders 2. Multi-nation funding coordination 3. Political will sustainability 4. Geopolitical complications (especially routes to Kyiv/Istanbul) 5. Learning from HS2's failures,2025-04-02T09:39:51.547Z,2025-04-02T09:39:51.798Z,0,0,1,False,HS2
at://did:plc:mkjv7gwefp4lpje7qmvc42al/app.bsky.feed.post/3llt3rpc2lb2j,ukconstructionblog.bsky.social,UK Construction Blog,"The numbers are staggering: 22,000km of track, speeds up to 249mph, 5 interconnected lines. Designed to make ""the continent feel whole again"" by connecting East and West. But can Europe achieve what the UK couldn't with HS2?",2025-04-02T09:39:51.161Z,2025-04-02T09:39:51.402Z,0,0,1,False,HS2
at://did:plc:mkjv7gwefp4lpje7qmvc42al/app.bsky.feed.post/3llt3rp43uo2k,ukconstructionblog.bsky.social,UK Construction Blog,"BREAKING: While UK scales back HS2, Europe unveils 'Starline' - a €850B high-speed rail network connecting 39 stations from London to Kyiv. This is either the boldest infrastructure vision of our time... or the most expensive pipe dream.",2025-04-02T09:39:50.805Z,2025-04-02T09:39:51.198Z,0,0,1,False,HS2
at://did:plc:qglonbp5yy2la74n5psfsqhq/app.bsky.feed.post/3llt2yxmdbe2z,politicalquarterly.bsky.social,Political Quarterly,"""Without sufficient rizz evident in Downing Street, political enthusiasm for the #HS2 evaporated.""

By @iaindocherty.bsky.social & Jon Shaw",2025-04-02T09:26:00.602Z,2025-04-02T09:26:01.298Z,0,0,0,True,HS2
at://did:plc:2ltfq6ifwbd5xdsk424womxs/app.bsky.feed.post/3llt2pdd6am2j,boersenfuchs.bsky.social,Börsenfuchs,Elon’s spending inefficiencies are staggering. Misallocated capital mirrors Tories' HS2 fiasco. Focus on tangible assets and fundamentals. Potential loss due to misjudged PR. Regulatory risk looms in EU and blunts quick wins. https://bsky.app/profile/maxberger.bsky.social/post/3llsgbylllc2o,2025-04-02T09:20:37Z,2025-04-02T09:20:38.197Z,0,0,0,True,HS2
at://did:plc:vmykjmkxda43rvimzftbfnsn/app.bsky.feed.post/3llsyblsiwc2m,mtdomain.bsky.social,MTDomain 🦋,"I don't object to taxes. I object to wastage:

Thames Water £3bn. But I paid - Oh, it went to shareholders.

HS2 £32bn - ATM flying's cheaper than train, will HS2 be less?

Rwanda £270m. Nuff said.

27 Subsidised bars & cafés in HoP. Won't let me in ☹️

TV licence gets BBC £3.7bn. I don't use BBC.",2025-04-02T08:37:09.509Z,2025-04-02T08:37:10.202Z,5,0,0,False,HS2
at://did:plc:xcvz66r6bcwoybhamr6ugsw2/app.bsky.feed.post/3llsvvuzp2c2n,cdtug.bsky.social,Chesham and District Transport Users Group,"HS2 bridge works at Wendover will affect @chilternrailway.bsky.social services through Amersham and Chalfont & Latimer on most weekends in April.
#Amersham #Chesham
www.chilternrailways.co.uk/tickets-and-...",2025-04-02T07:54:49.044Z,2025-04-02T07:54:51.801Z,0,1,0,False,HS2
at://did:plc:kbfnciizwqrfomaulbecngwo/app.bsky.feed.post/3llsrkvki7c2m,markavery.bsky.social,Mark Avery,"Guest blog: HS2’s Badly Behaved Little Brother by Euan Dunn markavery.info/2025/04/02/g...

#rail #bats #barbastelle #Cambridge #eastwestrail @batconservation.bsky.social #NE #Defra #HS2",2025-04-02T06:37:05.488Z,2025-04-02T06:37:12.301Z,6,1,0,True,HS2
at://did:plc:xznpyq3fyylssivussfg5od5/app.bsky.feed.post/3llrsk3kfrs2b,shropshirematt.bsky.social,MᴀᴛᴛA,"I know, we don't ""need"" HS2, but as it's being built, why not link it to Eurostar 0.6 miles away.",2025-04-01T21:21:52.267Z,2025-04-01T21:21:51.702Z,3,0,0,False,HS2
at://did:plc:z3f2ubxdtfkx3m7kufbe7kbq/app.bsky.feed.post/3llrntdtcl227,roaringmeg.bsky.social,Meg,We managed home in the English Midlands to Stuttgart all by train. Who needs HS2?,2025-04-01T19:57:34.229Z,2025-04-01T19:57:34.897Z,1,0,1,False,HS2
at://did:plc:ksaev3cfvs47j2qscqqm7aob/app.bsky.feed.post/3llrjhwn7rs25,farawaywatcher.bsky.social,,Emperors new clothes all over. And our politicians fall for it. Do they not heed the evidence? If I presented a proposal that had odds similar to this it would be dumped. Oh - it has - HS2.,2025-04-01T18:39:36.331Z,2025-04-01T18:39:37.304Z,0,0,0,False,HS2
at://did:plc:bmgq3kvfpuhzygzr5hqadtto/app.bsky.feed.post/3llrj6kxdsk2t,smoulderstoat.bsky.social,Jon Patience,"Why HS2 should have been called the West Coast Capacity Improvement Programme, with particular reference to service braking distance.",2025-04-01T18:34:22.089Z,2025-04-01T18:34:21.649Z,3,1,2,True,HS2
at://did:plc:nuwjduzsptchox44vhj77riq/app.bsky.feed.post/3llrhg3axpu2q,earlycareers.bsky.social,EarlyCareers.co.uk,"🚧 #Graduate Quantity Surveyor @ Dragados

📍 #Birmingham – Work on HS2’s Curzon Street Station

Get hands-on with cost & contract management on one of the UK’s biggest infrastructure projects.

🔗 vist.ly/3mysck8

",2025-04-01T18:02:46.078Z,2025-04-01T18:02:47.513Z,1,0,1,True,HS2
at://did:plc:asvpekgdxrzfy4dmnyw6ekbm/app.bsky.feed.post/3llr7kbscvs2m,johnsensible.bsky.social,Dr John Sensible 🍃💚🍃,"#HS2isDead 🚂💷💷💷
#StopHS2 #HS2
londonist.com/london/trans...",2025-04-01T15:41:57.722Z,2025-04-01T15:41:58.804Z,0,0,0,True,HS2
at://did:plc:xznpyq3fyylssivussfg5od5/app.bsky.feed.post/3llr6lssaks2b,shropshirematt.bsky.social,MᴀᴛᴛA,"If only they could find the money to connect HS2 an extra 0.6mile to St Pancras. There would be a whole air-travel free world for a lot more Brits.

Our country is a tad embarrassing.",2025-04-01T15:24:55.357Z,2025-04-01T15:24:55.700Z,1,0,1,False,HS2
at://did:plc:f76oprqqkb3s7pljphhl4adb/app.bsky.feed.post/3llr4vuc63k2o,brimfulofnasha.bsky.social,BrimfulofNasha,"Is it that time already? Although it won’t be for much longer, if HS2 has anything to do with it!😕🚴😎 #Cov🐘🩵",2025-04-01T14:54:44.982Z,2025-04-01T14:54:48.806Z,1,0,0,True,HS2
at://did:plc:bmvbevyymawntv4ejwfitvm6/app.bsky.feed.post/3llr2kleius23,iwanwills.bsky.social,Iwan Williams,"Felly ni’n rhoi £4Bn HS2 drosodd,da ni 30% o’n plant mewn tlodi,gewn ni ddim Stad y Goron,a bydd newidiade hyn yn gwaethygu ni?A chi dal o blaid yr Undeb / So we give over £4Bn HS2,we have 30% kids in poverty,we’re denied Crown Estate,& these changes will worsen us?And you still defend the Union 🤷🏻‍♂️🏴󠁧󠁢󠁷󠁬󠁳󠁿",2025-04-01T14:12:39.047Z,2025-04-01T14:12:39.699Z,3,0,0,True,HS2
at://did:plc:6nqaygrezs6o7ingeo7lzxko/app.bsky.feed.post/3llqykw2yik2r,hanssolon.bsky.social,Joshua Van Der Sluys,True that the HS2 probably shouldn't be used as an April Fools joke article.,2025-04-01T13:37:02.787Z,2025-04-01T13:37:05.301Z,0,0,0,False,HS2
at://did:plc:aytyymjcxrwgt75utd6jt3bn/app.bsky.feed.post/3llqxzhkil223,jacquep.bsky.social,Pascal Jacquemain,"I was never aware of the 12 noon rule until I moved to the UK.
Anyway, this made me laugh

HS2 Will Now Only Run Between Euston And Old Oak Common
londonist.com/london/trans...",2025-04-01T13:27:17.141Z,2025-04-01T13:27:19.401Z,20,3,5,True,HS2
at://did:plc:k2thuqlyolyq6c52qlsqefp6/app.bsky.feed.post/3llqs7torps2z,krikayda.bsky.social,,"Alt cosplay clothing set , this time it's time for a My SpiderVerse (Complet Oufit)  #HS #HS2 #HoneySelect #HoneySelect2 #OC #ハニーセレクト2 #StudioNeoV2 #saduko #Slenderwoman #cosplay #SpiderVerse #spiderwoman",2025-04-01T11:43:28.623Z,2025-04-01T11:43:31.406Z,5,0,0,True,HS2
at://did:plc:k2thuqlyolyq6c52qlsqefp6/app.bsky.feed.post/3llqs6agihk2z,krikayda.bsky.social,,"Hello to all my dear humans, cosplay clothing set , this time it's time for a My SpiderVerse (Complet Oufit)  #HS #HS2 #HoneySelect #HoneySelect2 #OC #ハニーセレクト2 #StudioNeoV2 #saduko #Slenderwoman #cosplay #SpiderVerse #spiderwoman",2025-04-01T11:42:34.870Z,2025-04-01T11:42:38.204Z,4,0,0,True,HS2
at://did:plc:qddpbm5y6xspavnzkw7a2d3m/app.bsky.feed.post/3llqq3genek2h,lostinmilbury.bsky.social,Steve Beresford,"Also on today’s 15-min walk I took this pic while on the footpath through the HS2 site.
#GettingFit
It feels quite grim along here, sort of isolated, with no way out, because the beginning and end are soon lost behind the curves of the pathway.
But the view through the metal fence is nice...",2025-04-01T11:05:13.049Z,2025-04-01T11:05:16.903Z,3,0,0,True,HS2
at://did:plc:qddpbm5y6xspavnzkw7a2d3m/app.bsky.feed.post/3llqptgavp22h,lostinmilbury.bsky.social,Steve Beresford,"Today’s walk: >15 mins
Really pushed myself today & just about made it over the 15-min mark. Those last few paces were pretty tough though & I was *quite* breathless at my front door.
#GettingFit	
Pic shows my short extra trip (to add a bit of distance to my walk) into the midst of the HS2 site...",2025-04-01T11:00:44.443Z,2025-04-01T11:00:55.898Z,4,0,0,True,HS2
at://did:plc:4wg73753zfo56mjr2nkmu7ug/app.bsky.feed.post/3llqkb7fpwc2a,bmlbod.bsky.social,Ash,"""The revised HS2 Route will be a huge boon to London's commuters,"" adds Bluff, ""Especially those who live in Acton and work in Euston. Or live in Euston and work in Acton.""

Well done 😂😉",2025-04-01T09:21:04.645Z,2025-04-01T09:21:05.901Z,0,0,0,False,HS2
at://did:plc:2quri6m57xrbxvuoneddj4am/app.bsky.feed.post/3llqk3rssan2y,spetersacademy.bsky.social,St Peter's Collegiate Academy,"During the visit, students learned about the diverse range of careers involved in bringing HS2 to life, from engineering and project management to environmental planning and site operations. They then put their skills to the test in practical workshops, experiencing some of the hands-on challenges.",2025-04-01T09:18:02.572Z,2025-04-01T09:18:02.895Z,0,0,0,False,HS2
at://did:plc:2quri6m57xrbxvuoneddj4am/app.bsky.feed.post/3llqk3r7boo2x,spetersacademy.bsky.social,St Peter's Collegiate Academy,"Year 10 Students Explore Careers at HS2 Construction Site 👷‍♂️🔧

A group of our Year 10 students had a fantastic opportunity to visit the HS2 construction site, gaining first-hand insight into one of the UK's biggest infrastructure projects.",2025-04-01T09:18:01.909Z,2025-04-01T09:18:02.697Z,0,0,1,True,HS2
at://did:plc:fbikctgjmhx24lik4zecb2fu/app.bsky.feed.post/3llqh4fzyjs23,mikepjones1.bsky.social,Mike Jones,"Thank you, that’s fascinating. I stand corrected. And given the ‘oh, only UAVs at first’ (why?), and the radio silence since, I still can’t see it happening. The entire programme is an utter shambles of HS2 proportions. I hope I’m wrong.",2025-04-01T08:24:42.602Z,2025-04-01T08:24:44.098Z,0,0,0,False,HS2
at://did:plc:nczkfdw5vpj2aeqxo5xrnq5o/app.bsky.feed.post/3llqf6lvid22h,kinsella82.bsky.social,Pete 'the Comedy Wulrus' Kinsella,"She's right. I was banned from an all you can eat Buffet because I criticised HS2. 
Of course on my restraining order it said it was because
1. You can't bring your own 'cutlery'.
2. I was 'growling' at other customers
3. A shovel isn't cutlery.
But I know!
www.theguardian.com/world/2025/m...",2025-04-01T07:50:08.372Z,2025-04-01T07:41:16.301Z,0,0,0,True,HS2
at://did:plc:asvpekgdxrzfy4dmnyw6ekbm/app.bsky.feed.post/3llqe2unuk22k,johnsensible.bsky.social,Dr John Sensible 🍃💚🍃,#HS2 #omnishambles #StopHS2,2025-04-01T07:30:09.529Z,2025-04-01T07:30:11.302Z,0,1,0,True,HS2
at://did:plc:osdeozpzbpxfw7fjr6hxkxxb/app.bsky.feed.post/3llqd36iye22a,alanpbourke.bsky.social,Alan B,You could have Arteta announced as driving the HS2 and hundreds of saps would believe it.,2025-04-01T07:12:26.185Z,2025-04-01T07:12:28.598Z,2,0,1,False,HS2
at://did:plc:gdypdncb66gxdqwpykbdx52m/app.bsky.feed.post/3llqczexdqc2f,a-b-evans.bsky.social,Dr Adam Evans,Incredible new report out from @walesgovernance.bsky.social this morning reveals that the Welsh Govt actually *owes* HS2 Ltd and the Treasury £400m in reverse consequentials for the South Wales Metro scheme,2025-04-01T07:11:25.834Z,2025-04-01T07:11:26.500Z,1,0,2,False,HS2
at://did:plc:s7s6xmsxt33k7qp6k4vr7zem/app.bsky.feed.post/3llqcp6v2bk2c,jenbren.bsky.social,🎄For Lease Now - Yer Dad🎄,"Mind you so far on FB I've read that Arteta's getting sacked and that the HS2 is now gonna be London only

Thousands have fallen for them both ffs",2025-04-01T07:05:43.926Z,2025-04-01T07:05:44.801Z,3,0,1,False,HS2
at://did:plc:vjlh6ymtmyvtlvufcsggf3ps/app.bsky.feed.post/3llqa45xew22a,londonist.com,Londonist,The revised HS2 route means it'll only run between Euston and west London 🫣,2025-04-01T06:19:17.932Z,2025-04-01T06:19:22.500Z,7,1,1,True,HS2
at://did:plc:rja3ymhaauuuwiqzzuqb7gfq/app.bsky.feed.post/3llppsyarac2b,lotty-tasty.bsky.social,⅄ꓕꓕOꓶ,ご安心を！去年末に勢いで買ったHS2を動かしてみましたが、難しくて既に心が折れています😤,2025-04-01T01:27:50.081Z,2025-04-01T01:27:53.020Z,3,0,0,True,HS2
at://did:plc:eieucyycdvauquh54fehjba3/app.bsky.feed.post/3lo2ocluxe22d,sayno2sizewellc.bsky.social,Together Against Sizewell C,"“govt & regulators have failed to drive sufficient investment in the water sector” Yet govt has splurged £6.4bn on water guzzling Sizewell C in UK's driest region even tho' it has no guaranteed mains water supply for the 2.2m litres/day needed for its 60yrs of operation
inews.co.uk/news/environ...",2025-04-30T20:50:26.888Z,2025-04-30T20:50:28.387Z,2,1,0,True,Sizewell C
at://did:plc:eieucyycdvauquh54fehjba3/app.bsky.feed.post/3lnxwa5lwps2l,sayno2sizewellc.bsky.social,Together Against Sizewell C,"""Sizewell C, has already cost the Treasury £2.5bn, with a further subsidy of £5.5bn announced just to get the project to a FID... The FID has been said to be ‘imminent’ for the past 4yrs..."" & the huge environmental cost is incalculable😪
#SayNo2SizewellC
www.tcpa.org.uk/wp-content/u...",2025-04-29T18:34:15.522Z,2025-04-29T18:34:17.780Z,1,1,0,True,Sizewell C
at://did:plc:ryp6rrv2npxggq5upkg4bmyz/app.bsky.feed.post/3lnwxy5bzj22v,thomasig.bsky.social,Thomas I-G,"On energy in particular there is a lot to be positive about imo - planning rule changes could negate a lot of objections, investment in Sizewell C, greenlighting offshore & onshore wind projects etc - but as long as infrastructure in general remains higher than European partners it will take years.",2025-04-29T09:32:54.508Z,2025-04-29T09:32:55.280Z,1,0,0,False,Sizewell C
at://did:plc:nkhuwsdxij3ooxkr7fkqz22d/app.bsky.feed.post/3lnwwtmrgz22f,netzerointel.bsky.social,ErhanEren@enkiai.com,"💥Nuclear promises clean power—but at what cost?

💸Sizewell C: £2.5B sunk, years from power
🌊Renewables like tidal = cheaper, faster
⚠️Hanford cleanup alone: $589B

We track the #EnergyTransition — end to end. See how at enkiai.com
#Energy #CleanTech",2025-04-29T09:12:29.221Z,2025-04-29T09:12:31.278Z,2,0,1,True,Sizewell C
at://did:plc:p5nnabuplqwirlu6nvvrqjch/app.bsky.feed.post/3lnwky62x3c2q,giza009kkg.bsky.social,Sargent Salt & Pepa,"to scrap all planned nuclear power stations. These include the crazily expensive Sizewell C, which has already received nearly £2.5bn in subsidies before it has even started construction...

#RenewableEnergy 

www.theguardian.com/money/2025/a...",2025-04-29T05:40:16.682Z,2025-04-29T05:40:20.187Z,1,3,0,True,Sizewell C
at://did:plc:rp7tn4sfm2t632cfnl4j325x/app.bsky.feed.post/3lnvlyfvafk25,efhoward.bsky.social,MythicBrush,"Another day, another hoard: 321 silver coins from 11th-century England, wrapped like a Cornish pasty, found at Sizewell C. Was “coin hoard” on your 2025 bingo card yet? 🏺🪙 #Archaeology #CoinHoard #SizewellC #MedievalEngland",2025-04-28T20:25:38.887Z,2025-04-28T20:25:41.284Z,42,9,1,True,Sizewell C
at://did:plc:dbosxelhf4mcedm4imbabnom/app.bsky.feed.post/3lnuul6vcws2g,gp5.bsky.social,GP500 🇺🇦📊⚛️☕🙏,"Still no, it is able to adapt if needed. 
You need more nuclear capacity.

HP-C is costly,  expensive is the electricity you need but, don't have.
HP-C has a fixed price structure.

Together with Sizewell-C it still not going to be even enough to provide the minimum electricity needs in the UK.",2025-04-28T13:26:39.280Z,2025-04-28T13:26:40.586Z,0,0,1,False,Sizewell C
at://did:plc:eieucyycdvauquh54fehjba3/app.bsky.feed.post/3lnsulyo3b22o,sayno2sizewellc.bsky.social,Together Against Sizewell C,"Not content with chopping down 30,000 trees, which Sizewell C say ""is in the DCO"", now this all ahead of FID-see para 3.1.2 
""the amendments [to the approved DCO] will result in the clearance of an additional 23,956 square meters of existing woodland""!
publicaccess.eastsuffolk.gov.uk/online-appli...",2025-04-27T18:21:46.826Z,2025-04-27T18:21:49.983Z,5,5,0,True,Sizewell C
at://did:plc:zp4zay62b64a763vo3mlwnge/app.bsky.feed.post/3lnspubuayk2k,dangrey.bsky.social,Dan Grey,"EDF is losing money on Hinkley Point C and can't get investors for Sizewell C, so the French government is asking for the British government to take money from Brits to finance them.

As EDF is state-owned, it's currently French taxpayers who are on the hook.",2025-04-27T16:56:56.191Z,2025-04-27T16:56:56.082Z,6,2,0,True,Sizewell C
at://did:plc:nprqwk6yqc3bqd36hat44qex/app.bsky.feed.post/3lnpik2hkxk2f,dilloncoen25.bsky.social,Dilloncoen,String an interconnection cable from thermo abundant Iceland to Scotland? Instead of spending GBP40 billion plus constructing Sizewell C ? What a waste,2025-04-26T10:07:57.485Z,2025-04-26T10:07:58.581Z,1,0,1,False,Sizewell C
at://did:plc:5ekaaudi6pc22b4axp54hqre/app.bsky.feed.post/3lnnxmmcdp72y,fr-france.bsky.social,FR #France,"Encore une bonne nouvelle pour la France sur le chantier le plus important du Royaume-Uni à 23,5 milliards d’euros pour 2 réacteurs nucléaires EPR

https://www.europesays.com/fr/52458/

Framatome équipe Sizewell C de 8 000 capteurs de précision pour surveiller ses futurs réacteurs …#fr #france",2025-04-25T19:32:28+00:00,2025-04-25T19:32:30.582Z,0,0,0,True,Sizewell C
at://did:plc:smcajkfn2ljo2b2h7pj6huot/app.bsky.feed.post/3lnnocsemnk23,drpauldorfman.bsky.social,Dr Paul Dorfman ,Opportunities to Get Active and Stop Sizewell C new nuclear open.substack.com/pub/radiatio...,2025-04-25T16:45:57.095Z,2025-04-25T16:45:59.879Z,4,2,0,True,Sizewell C
at://did:plc:kxbvton3poawjjj4r3xv2p35/app.bsky.feed.post/3lnnjbvm2r224,glassrod57.bsky.social,,Breaks my heart that we are held back by Westminster. Who knows who is in whose pocket on energy provision. Sizewell C - £40 Bn instead of £20 Bn. Hinkley Point- £46 Bn instead of £16 Bn. Completion moved out at least 5-6 years. Corruption in the form of lobbying/donations seem to be endemic.,2025-04-25T15:15:58.220Z,2025-04-25T15:15:58.885Z,1,0,1,False,Sizewell C
at://did:plc:eieucyycdvauquh54fehjba3/app.bsky.feed.post/3lnnhzkhczc2e,sayno2sizewellc.bsky.social,Together Against Sizewell C,"...chose to ignore local concerns from 2010 regarding Sizewell C's mains water supply ""...I cannot see how the water company is going to avoid problems if Sizewell C is built"" see becclesandbungayjournal.co.uk/news/2217376...
DCO approved w/out a guaranteed mains water supply & that position remains",2025-04-25T14:53:22.620Z,2025-04-25T14:53:24.097Z,0,1,0,True,Sizewell C
at://did:plc:eieucyycdvauquh54fehjba3/app.bsky.feed.post/3lnnhziseok2e,sayno2sizewellc.bsky.social,Together Against Sizewell C,"To say public consultation meant 'Sizewell C spent around 7.5 years at this stage' is totally misleading- delays were down to EDF's reluctance to proceed & their incompetence in developing their plans-they made 19 major changes AFTER submitting the DCO application &...🧵
www.gov.uk/government/n...",2025-04-25T14:53:22.619Z,2025-04-25T14:53:24.082Z,4,1,1,True,Sizewell C
at://did:plc:eieucyycdvauquh54fehjba3/app.bsky.feed.post/3lnnhj4yrlk2e,sayno2sizewellc.bsky.social,Together Against Sizewell C,"No surprise- EDF were warned by locals in 2010 that Sizewell C will struggle to meet their mains water needs- see www.becclesandbungayjournal.co.uk/news/2217376...
It's why the planning inspectorate rightly recommended refusal Operational water may be planned but still no guarantee!
#SayNo2SizewellC",2025-04-25T14:44:13.374Z,2025-04-25T14:44:15.089Z,3,3,0,True,Sizewell C
at://did:plc:smcajkfn2ljo2b2h7pj6huot/app.bsky.feed.post/3lnmrj3kp422u,drpauldorfman.bsky.social,Dr Paul Dorfman ,"EDF #nuclear France try to manage significant cost and time over-runs at Hinkley C and ramping proposed costs at planned Sizewell C.

Not a good look ...

www.cityam.com/edfs-two-nuc...",2025-04-25T08:10:29.544Z,2025-04-25T08:10:33.482Z,13,4,1,True,Sizewell C
