uri,author,author_name,text,created_at,indexed_at,likes,reposts,replies,has_media,keyword
at://did:plc:3s4k5hm6utqh4t3jolwsjc4x/app.bsky.feed.post/3lykni2serv2g,social.newcivilengineer.com,New Civil Engineer,"Barhale has been appointed to carry out a new phase of utilities works around the planned London Euston terminus for the High Speed 2 (HS2) after being awarded the work by HS2 station construction partner Mace Dragados

Full story:",2025-09-11T11:30:07.442Z,2025-09-11T11:30:09.310Z,0,0,0,True,HS2
at://did:plc:msian4dqa2rqalf3biilnf3m/app.bsky.feed.post/3lykijmhz2p2e,europesays.bsky.social,EUROPE SAYS,"HS2 Completes Construction of Britain’s Longest Rail Bridge

https://www.europesays.com/2402860/

HS2 has announced the completion of civil engineering works on the Colne Valley viaduct, now the longest rail…",2025-09-11T10:01:29+00:00,2025-09-11T10:01:33.203Z,0,0,0,True,HS2
at://did:plc:msian4dqa2rqalf3biilnf3m/app.bsky.feed.post/3lykihqhxn72u,europesays.bsky.social,EUROPE SAYS,"HS2 Completes Construction of Britain’s Longest Rail Bridge

https://www.europesays.com/2402860/

HS2 has announced the completion of civil engineering works on the Colne Valley viaduct, now the longest rail…",2025-09-11T10:00:25+00:00,2025-09-11T10:00:29.902Z,0,0,0,True,HS2
at://did:plc:aufjbmh3rswy2wlinqixhwan/app.bsky.feed.post/3lykfwtvy3k2n,acursedhalo.bsky.social,acursedhalo 🖤,"Wait, I need to replay again to make sure, but MC can hide from Raphael when she blinds him because he can't sense her energy because she doesn't give off any...

Yet Malbonte is always, always, always without fail able to sense MC (HS2 and now again in HS3 ep 6) no matter what? Ah, romantic. 😭

#RC",2025-09-11T09:15:14.815Z,2025-09-11T09:15:16.005Z,0,0,1,False,HS2
at://did:plc:bepbuifyzwtv342kymj5ulyd/app.bsky.feed.post/3lykfgamajx2r,aibizmatome.bsky.social,本川@AIビジネスまとめ,"英国最長鉄道橋コルンバレー高架橋、完成もHS2高速鉄道の運行にはさらなる遅れと不透明感 - AIビジネスまとめ

▼詳細はこちら",2025-09-11T09:05:57.635874+00:00,2025-09-11T09:05:58.403Z,0,0,0,True,HS2
at://did:plc:crb2e2pnwgtgiorwx6ydcyhb/app.bsky.feed.post/3lykdrdopos23,railfocus.bsky.social,Rail Focus - Chris 🏳️‍🌈,"Sunday's video which provides an update about Old Oak Common is live and advert free for Patreon and YouTube members. 
▶️ www.patreon.com/Chris_Rail_F... ◀️ #HS2",2025-09-11T08:36:22.506Z,2025-09-11T08:36:22.503Z,4,1,0,True,HS2
at://did:plc:hfyl2cft6eyaofowhu5eyufg/app.bsky.feed.post/3lykaumhbfk2r,mainline421.bsky.social,JC,Some good news from #HS2 www.bbc.co.uk/news/article...,2025-09-11T07:44:31.175Z,2025-09-11T07:44:35.506Z,1,0,0,True,HS2
at://did:plc:b22lg2k7lrkboz33eb6fwv3o/app.bsky.feed.post/3lyk3e42bu62y,hertfordshireuk.bsky.social,Hertfordshire,"HS2 finishes 'UK's longest railway bridge'

#Herts #Hertfordshire #BedsBucksHerts

🔗: https://www.bbc.com/news/arti...",2025-09-11T15:05:47.709762+09:00,2025-09-11T06:05:48.607Z,1,0,0,True,HS2
at://did:plc:rvwe2ojkwe2efkdch33pfl2t/app.bsky.feed.post/3lyk36i5ykl24,bedfordshireuk.bsky.social,Bedfordshire,"HS2 finishes 'UK's longest railway bridge'

#Bedfordshire #BedsBucksHerts

🔗: https://www.bbc.com/news/arti...",2025-09-11T15:02:39.090140+09:00,2025-09-11T06:02:40.504Z,0,0,0,True,HS2
at://did:plc:omjy2epk32loxcrkw5auft6u/app.bsky.feed.post/3lyisuhfqec2v,ruby0t.bsky.social,Ruby ❦,"My relationship goals are like HS2

expensive, a mess, and never finished :P

I'm sure it'll all fall into piece somehow.",2025-09-10T18:01:13.746Z,2025-09-10T18:01:14.331Z,2,0,0,False,HS2
at://did:plc:7a2tz472plo3vglw54p32jgk/app.bsky.feed.post/3lyisguifuk2h,supportourpoops.bsky.social,Cadence ”Too Much Water Actually” Andrysiak,"Ultimately though folks drawing conclusions from this neglect to mention the sheer simplicity of the operation of such a thing as compared to, I dunno, HS2, or a treatment plant, or…",2025-09-10T17:53:37.714Z,2025-09-10T17:53:38.207Z,3,0,0,False,HS2
at://did:plc:qz3fopoj6yixtnbfiidfhuqy/app.bsky.feed.post/3lyioo3zwor24,hsrailgroup.bsky.social,High Speed Rail Group,'Mini-HS2' link in the Midlands could allow high-speed services to run to Yorkshire.,2025-09-10T16:46:04.139Z,2025-09-10T16:46:05.729Z,0,0,0,True,HS2
at://did:plc:32dnyjpdqwdfhcx5evu6lb2p/app.bsky.feed.post/3lyinkpvypc2h,dailyherald.bsky.social,Daily Herald #FBPE #NAFO,"Labour is committing approximately £22.4 billion in additional transport funding over this Parliament:

£15.6 bn regional public transport (buses, trams, metros) outside London; £4.7 bn Local Transport Fund (North & Midlands) from HS2 savings; £3.5bn for TransPennine Route upgrade;",2025-09-10T16:26:17.280Z,2025-09-10T16:26:18.742Z,0,0,1,False,HS2
at://did:plc:4uohnv5ybzy436p22e5wyhbp/app.bsky.feed.post/3lyilrbetl22p,quantinghome.bsky.social,Andrew Thomson,"On a doubled-up cross country train from Brum to Leeds. Even with 8 carriages it's still busy. Huge potential on this route. This was to have been the eastern branch of HS2, now sadly cancelled. Needs an upgrade at least as big as the transpennine is currently getting.",2025-09-10T15:54:10.577Z,2025-09-10T15:54:10.604Z,3,1,0,False,HS2
at://did:plc:32dnyjpdqwdfhcx5evu6lb2p/app.bsky.feed.post/3lyilbdjtil2e,dailyherald.bsky.social,Daily Herald #FBPE #NAFO,"Labour is committing approximately £22.4 billion in additional transport funding over this Parliament:

£15.6 bn regional public transport (buses, trams, metros) outside London; £4.7 bn Local Transport Fund (North & Midlands) from HS2 savings; £3.5bn for TransPennine Route upgrade;",2025-09-10T15:45:13.240Z,2025-09-10T15:45:17.235Z,0,0,1,False,HS2
at://did:plc:b22lg2k7lrkboz33eb6fwv3o/app.bsky.feed.post/3lyieursl772g,hertfordshireuk.bsky.social,Hertfordshire,"HS2 finishes 'UK's longest railway bridge'

#Herts #Hertfordshire #BedsBucksHerts

🔗: https://www.bbc.com/news/arti...",2025-09-10T22:50:51.608185+09:00,2025-09-10T13:50:53.211Z,0,0,0,True,HS2
at://did:plc:rvwe2ojkwe2efkdch33pfl2t/app.bsky.feed.post/3lyieo75px72j,bedfordshireuk.bsky.social,Bedfordshire,"HS2 finishes 'UK's longest railway bridge'

#Bedfordshire #BedsBucksHerts

🔗: https://www.bbc.com/news/arti...",2025-09-10T22:47:10.719086+09:00,2025-09-10T13:47:12.610Z,0,0,0,True,HS2
at://did:plc:jh26xuzxhqewzb4r2apizwpf/app.bsky.feed.post/3lyicx3xlhc2c,ogilvie.org.uk,Chris Ogilvie,"Exactly. To be fair it’s 150km of new build track, €6Bn.
The Messina Strait road & rail bridge opens in 2032, before HS2, they haven’t started it yet.",2025-09-10T13:16:22.554Z,2025-09-10T13:16:23.607Z,1,0,1,False,HS2
at://did:plc:5h36jznnvv7kul2hc73soiyj/app.bsky.feed.post/3lyiamc6g5k2u,pzw4569.bsky.social,Paul,"HS2 not a benefit to people of Wales.
www.janetfinchsaunders.org.uk/news/welsh-g...",2025-09-10T12:34:32.486Z,2025-09-10T12:34:35.907Z,0,0,0,True,HS2
at://did:plc:3s4k5hm6utqh4t3jolwsjc4x/app.bsky.feed.post/3lyiaehh2t32t,social.newcivilengineer.com,New Civil Engineer,"High Speed 2 (HS2) main works contractor Align JV (Bouygues Travaux Publics, Sir Robert McAlpine, VolkerFitzpatrick) has announced the Colne Valley Viaduct, the UK’s new longest railway bridge, is fully complete

Full story:",2025-09-10T12:30:07.978Z,2025-09-10T12:30:12.004Z,0,0,0,True,HS2
at://did:plc:qz3fopoj6yixtnbfiidfhuqy/app.bsky.feed.post/3lyi76pi6mm23,hsrailgroup.bsky.social,High Speed Rail Group,HS2’s Old Oak Common station could boost the local economy by £10 billion over a decade.,2025-09-10T12:09:00.973Z,2025-09-10T12:09:03.304Z,0,0,0,True,HS2
at://did:plc:bingsh4eg762d5cesrp62uej/app.bsky.feed.post/3lyi66m3lbc2x,jay.blan.cc,Jay Blanc,"This is what can happen when a big infrastructure project isn't undermined by politicians. Unlike HS2, none of the borough councils started a campaign of tax-payer funded lawsuits against Thames Tideway for purely political reasons. The engineering can be done, with safety and ecology respected.",2025-09-10T11:51:05.633Z,2025-09-10T11:51:05.904Z,3,0,0,True,HS2
at://did:plc:36eow7va63cfa7lfh3chadb7/app.bsky.feed.post/3lyi54jclck2f,robertwoolley.bsky.social,Robert Woolley 🇬🇧🇮🇪,HS2 is being fixed by the guy who had to fix complex signalling projects at London Underground.,2025-09-10T11:32:01.867Z,2025-09-10T11:32:03.105Z,6,0,1,False,HS2
at://did:plc:32dnyjpdqwdfhcx5evu6lb2p/app.bsky.feed.post/3lyi4vgc2hk2d,dailyherald.bsky.social,Daily Herald #FBPE #NAFO,"Labour is committing approximately £22.4 billion in additional transport funding over this Parliament:

£15.6 bn regional public transport (buses, trams, metros) outside London; £4.7 bn Local Transport Fund (North & Midlands) from HS2 savings;",2025-09-10T11:28:03.072Z,2025-09-10T11:28:04.558Z,0,0,1,False,HS2
at://did:plc:lf437ikt6gk3kkpvqgjenxoh/app.bsky.feed.post/3lyi46sz7p22z,jphendo.bsky.social,John Henderson,"Hope they don't ""reward"" the guy by asking him to sort out HS2. He doesn't deserve to be lumbered with that.",2025-09-10T11:15:25.409Z,2025-09-10T11:15:26.508Z,1,0,1,False,HS2
at://did:plc:qkimdo6o3gwk2m6ue274a4sc/app.bsky.feed.post/3lyi45zqwhk2s,spanglish51.bsky.social,Susanita,"This does raise the paucity of public transport outside of core hours . 
Maybe a better target for taxpayers money than the white elephant HS2.
Get people to work ; not just to London .",2025-09-10T11:14:58.927Z,2025-09-10T11:14:59.703Z,0,0,0,False,HS2
at://did:plc:bo2iacbu4r2t326ohyljzjff/app.bsky.feed.post/3lyhwvkmk2c2q,joelsuss.ft.com,Joel Suss,Yes! HS2 unfortunately the exact opposite,2025-09-10T09:40:45.910Z,2025-09-10T09:40:47.106Z,1,0,0,False,HS2
at://did:plc:7zzswd5g2zbynzbowl3edpww/app.bsky.feed.post/3lyhwuhg73c23,sharkastic.bsky.social,,HS2?,2025-09-10T09:40:09.002Z,2025-09-10T09:40:10.404Z,1,0,0,False,HS2
at://did:plc:crb2e2pnwgtgiorwx6ydcyhb/app.bsky.feed.post/3lyhwl5phmc23,railfocus.bsky.social,Rail Focus - Chris 🏳️‍🌈,Construction of Britain’s longest rail bridge completed mediacentre.hs2.org.uk/news/job-don... #HS2,2025-09-10T09:34:56.829Z,2025-09-10T09:35:05.617Z,9,1,1,True,HS2
at://did:plc:rpdc2ijg2a3rs25xxaekqpun/app.bsky.feed.post/3lyhvnswzo225,bbolger.bsky.social,BGB,Hs2,2025-09-10T09:18:32.464Z,2025-09-10T09:18:32.905Z,1,0,0,False,HS2
at://did:plc:7i2jqcxg5ubzu72x6miszt4w/app.bsky.feed.post/3lyhvctmjvk22,bawsman.bsky.social,John Johnston,HS2,2025-09-10T09:12:24.069Z,2025-09-10T09:12:24.804Z,0,0,0,False,HS2
at://did:plc:s5y3aimo5hxqiqz2o6zslcyn/app.bsky.feed.post/3lyhuubu7gc2n,alpinemigrant.bsky.social,Alpine Migrant,"HS2 delivery. Or the UK could just hire back the guy who delivered HS1 under budget.

Crazy ideas, I know! Never happen.",2025-09-10T09:04:15.685Z,2025-09-10T09:04:16.103Z,1,0,0,False,HS2
at://did:plc:qz3fopoj6yixtnbfiidfhuqy/app.bsky.feed.post/3lyht6aphkd23,hsrailgroup.bsky.social,High Speed Rail Group,HS2 contractor celebrates 500th apprentice milestone.,2025-09-10T08:34:00.736Z,2025-09-10T08:34:02.704Z,0,0,0,True,HS2
at://did:plc:zfm5ppuimd3rpmcm6ikf6b3d/app.bsky.feed.post/3lyhrvsadwc2i,stephenh.bsky.social,Steve,"is that the East coast mainline to Aberdeen/Inverness?
Doesn’t surprise me. I’ve said all along that HS2 would stop at Birmingham, because it will be an hour to London, making it a commuter line for the City of London.",2025-09-10T08:11:25.188Z,2025-09-10T08:11:26.802Z,2,0,0,False,HS2
at://did:plc:3cniaomfcidid3kcmwyccqfu/app.bsky.feed.post/3lyhr5kklzk22,dennispatton.bsky.social,Dennis Patton,"HS2, Water, Rail, Bus, Hinkley, Rwanda.... oh you mean non grifting funding...",2025-09-10T07:57:51.830Z,2025-09-10T07:57:54.304Z,1,0,0,False,HS2
at://did:plc:x3zfu543ufrk5gltighwr2cy/app.bsky.feed.post/3lyhnzsen722s,uresg76.bsky.social,Urban and Regional Economics Research Seminar Group,Or even the Egan Report that influenced project management of T5 that HS2 could have learned from,2025-09-10T07:02:04.579Z,2025-09-10T07:02:05.209Z,1,0,0,False,HS2
at://did:plc:tcrheqfd4rcjgmwnnd4i35xl/app.bsky.feed.post/3lyhnu5bb2c2b,garethdennis.uk,Gareth Dennis,"Thanks! There's lots more to the HS2 failure, chief issue is the power of Treasury and the fundamental structure of our economy. But that didn't diminish the fact that we had it booked in and our failure to tell the story killed it.",2025-09-10T06:58:54.677Z,2025-09-10T06:58:53.300Z,3,0,0,False,HS2
at://did:plc:qog6nsef4qorna5p2gphot37/app.bsky.feed.post/3lyhdtryu4e2b,ianpatterson.com,Ian,"Oh ffs. When Sunak cancelled HS2 Phase 2a top Crewe he messed up plans to relieve one of the worst bottlenecks on the UK rail network. The ripple effect of that continues to work through, like around how the Class 895 trains seem set to be run in some longer single unit formations not as pairs. ...",2025-09-10T03:59:45.105Z,2025-09-10T03:59:45.602Z,0,0,1,False,HS2
at://did:plc:yfnemaellca64lvba3zwsaw6/app.bsky.feed.post/3lyh4no4ezs2v,nilo.bsky.social,Nilo,"Not convinced that HS2 cancellation was entirely a messaging and public engagement issue, really feel like there’s a book to be had in explaining the oddities of the relationship of the British Treasury to the public.",2025-09-10T01:51:03.725Z,2025-09-10T01:51:05.867Z,7,0,1,False,HS2
at://did:plc:it4wqyq67pyy2ruhqqpxlgv4/app.bsky.feed.post/3lyg7tws23s2e,andyinafield.bsky.social,Andyinafield ,Imagine a world where HMG had  committed fully (and began building from the right end) to the original HS2 plan.,2025-09-09T17:15:35.755Z,2025-09-09T17:15:34.904Z,0,0,0,True,HS2
at://did:plc:uan3ql7k426h24lrcirjlmd3/app.bsky.feed.post/3lyg4pd7dm22r,fbermingham.bsky.social,Finbarr Bermingham,"We make a lot in Europe, there are better trains than in the US... 

But reading, for example, the commission's toe-curlingly boring and mind-numbingly vague ""Strategic Foresight Report"" today, I sometimes wish there was a bit more emphasis on... getting shit done.

See also: UK's HS2",2025-09-09T16:19:18.483Z,2025-09-09T16:19:30.227Z,3,0,2,False,HS2
at://did:plc:d7ilm7eg75vovijdkvd7sffy/app.bsky.feed.post/3lyg4j6wyvk2i,andygeology.bsky.social,Andy Kingdon 🔶️,"This councillor is either staggeringly thick (probable) or showing voters that he'll say anything to oppose a (presumably) locally unpopular scheme. A tactic Greenpeace etc have been using for decades to block developments: HS2, nuclear PS etc.
This council will lose costs after a failed appeal.",2025-09-09T16:15:53.984Z,2025-09-09T16:15:54.910Z,1,0,0,False,HS2
at://did:plc:vg2mq2mhs36l7ghjuq6j4nbk/app.bsky.feed.post/3lyfzlavtb22q,robinknox.bsky.social,Robin K,Hs2 syndrome,2025-09-09T15:23:21.933Z,2025-09-09T15:23:21.912Z,0,0,0,False,HS2
at://did:plc:vidrfu2csbenje74jj2yzlfj/app.bsky.feed.post/3lyfwlrtaw22p,neilshima.bsky.social,Neil Shima,Still find the Green Party objecting to #HS2 very strange.,2025-09-09T14:29:58.448Z,2025-09-09T14:29:59.506Z,0,0,1,False,HS2
at://did:plc:32dnyjpdqwdfhcx5evu6lb2p/app.bsky.feed.post/3lyfuqtytxg2f,dailyherald.bsky.social,Daily Herald #FBPE #NAFO,"Labour is committing approximately £22.4 billion in additional transport funding over this Parliament:

£15.6 bn regional public transport (buses, trams, metros) outside London; £4.7 bn Local Transport Fund (North & Midlands) from HS2 savings; £3.5bn for TransPennine Route upgrade;",2025-09-09T13:56:49.149Z,2025-09-09T13:57:01.686Z,0,0,1,False,HS2
at://did:plc:32dnyjpdqwdfhcx5evu6lb2p/app.bsky.feed.post/3lyft3ydlcm2f,dailyherald.bsky.social,Daily Herald #FBPE #NAFO,"Labour is committing approximately £22.4 billion in additional transport funding over this Parliament:

£15.6 bn regional public transport (buses, trams, metros) outside London; £4.7 bn Local Transport Fund (North & Midlands) from HS2 savings; £3.5bn for TransPennine Route upgrade;",2025-09-09T13:27:25.015Z,2025-09-09T13:27:27.825Z,0,0,1,False,HS2
at://did:plc:su3is6nuo367zohdtbqszgca/app.bsky.feed.post/3lyfshwzjas2l,defencebrief.bsky.social,Nick Diable ,"lol I saw a film about HS2 a while back that was complaining about the damage to the natural environment of having a train running through the countryside. At the same time, they showed images of completely man-made farmers fields. Important things but hardly the natural environment.",2025-09-09T13:16:14.712Z,2025-09-09T13:16:11.409Z,17,0,1,False,HS2
at://did:plc:qvp4x4dz4slupgmtg6drcjqw/app.bsky.feed.post/3lyfr2jd5ec2q,ieatpie.bsky.social,Craig Grävling,"Also adds to time scales and costs if you have to factor in likely needing to go via appeals to make any headway.
Likely exactly as planned by those denying schemes unjustly- look at the tactics of the anti HS2 movement.",2025-09-09T12:50:50.397Z,2025-09-09T12:50:52.007Z,14,0,1,False,HS2
at://did:plc:32dnyjpdqwdfhcx5evu6lb2p/app.bsky.feed.post/3lyfqw7elqc2f,dailyherald.bsky.social,Daily Herald #FBPE #NAFO,"Labour is committing approximately £22.4 billion in additional transport funding over this Parliament:

£15.6 bn regional public transport (buses, trams, metros) outside London; £4.7 bn Local Transport Fund (North & Midlands) from HS2 savings; £3.5bn for TransPennine Route upgrade;",2025-09-09T12:48:17.573Z,2025-09-09T12:48:26.781Z,0,0,1,False,HS2
at://did:plc:6hw6ot27f4lpjuaxus7frhkz/app.bsky.feed.post/3lyfoj4jrqk2e,amrk.bsky.social,Amrk,Also forgive me but we couldn’t even finish HS2 there is absolutely no part of me that thinks these trams are happening,2025-09-09T12:05:19.075Z,2025-09-09T12:05:19.605Z,1,0,1,False,HS2
at://did:plc:5lgs2hjpao7jye4gqx4w3lkj/app.bsky.feed.post/3lyfogvo3dk2m,littlemavis.bsky.social,Mary Wombat,"You know, I reckon that HS2 would have won more support if it hadn't been labelled as HS2. Surely most people don't care about getting to London 20 minutes sooner
Maybe if they'd sold it as increased capacity & reliability it wouldn't have been seen as a frivolous boy's toy",2025-09-09T12:04:04.767Z,2025-09-09T12:04:08.104Z,4,0,2,False,HS2
at://did:plc:burspfcij6tfralbciubpmqs/app.bsky.feed.post/3lyfn54afx22z,bluebadgerdm.bsky.social,Blue_Badger,"I think not agreeing totally is fine. We may have different views on ID cards or HS2. 

But someone's right to exist without causing hard to others isnt up for debate. Its not a disagreement its a moral principle. And if your religion says they can't FUCK YOUR RELIGION.",2025-09-09T11:40:42.372Z,2025-09-09T11:40:43.405Z,4,0,2,False,HS2
at://did:plc:rm4am6hvx6hx2ojqj45lubyt/app.bsky.feed.post/3lyfiiru25c2x,owenpavey.bsky.social,Owen Pavey,"Farage's past comments suggest he's anti-rail network,anti-cycling and pro-road. There is talk of HS2 being cancelled but when large chunks of the initial leg to Birmingham have already been set in concrete the only use for the completed sections would be,rather ironically,a cycle path.",2025-09-09T10:17:45.423Z,2025-09-09T10:17:47.309Z,2,0,0,False,HS2
at://did:plc:xctwfqnm5djl3dc2kl6hnb5r/app.bsky.feed.post/3lyfiin55zc2r,gleanniucha.bsky.social,nicola,"NPR is not high speed rail - as the public understand it.

It was to have shared a small part of its track under previous proposals, before that Hs2 leg canned.

So he’s being disingenuous again to whip up opinion",2025-09-09T10:17:40.478Z,2025-09-09T10:17:41.608Z,3,0,0,False,HS2
at://did:plc:trgyzekr42u6kgdpfmgeirfj/app.bsky.feed.post/3lyfhx3coik2g,awjt.bsky.social,Adam Turner 🏳️‍🌈,"When colleagues and I wanted to change Green Party policy on HS2, we humanised the effects of the northern legs' cancellation: the increased fares for a Welsh person with caring responsibilities in the Midlands; the increased air pollution for working class communities in Manchester, etc. It worked.",2025-09-09T10:07:51.346Z,2025-09-09T10:07:55.203Z,26,8,0,True,HS2
at://did:plc:6eiu4wg5ynxzhxfhrmiwd4i6/app.bsky.feed.post/3lyfhoqg5mk22,neilginscotland.bsky.social,Neil Gwynne,Reform refer to Andrew Gilligan report who was instrumental in getting rest of HS2 canned under sunak and writing the network north plan which had numerous schemes in the south and was effectivel vapour ware or listed existing schemes under delivery,2025-09-09T10:03:11.505Z,2025-09-09T10:03:11.105Z,1,0,0,False,HS2
at://did:plc:vzf7hqjygd55yzipcfn6miwy/app.bsky.feed.post/3lyfh4qyt2k2q,thespian-misfit.bsky.social,Thespian Misfit,"This is the sheer ignorance, stupidity and malice at the heart of Reform UK as a 'party'. After all the damage that's been done environmentally already by HS2, and this man wants to abandon these projects, leaving devastation in their wake. Unbelievable!

www.theguardian.com/business/202...",2025-09-09T09:53:08.137Z,2025-09-09T09:53:11.305Z,1,0,0,True,HS2
at://did:plc:54nyo5m5kdzgpbbkxzeskdjt/app.bsky.feed.post/3lyfg35atoc2n,timbleman.bsky.social,Tony Dexter,Don't read it Boris look away over there. Oh God that's where our old house was that I got millions for when you agreed the line for HS2 should pass near.,2025-09-09T09:34:20.129Z,2025-09-09T09:34:22.107Z,0,0,0,True,HS2
at://did:plc:oo3kppddak7qrhuyzgvozldb/app.bsky.feed.post/3lyfemgt6pc2u,oldtrotter.bsky.social,David Higham,….keeping the northern leg of HS2 in place via the Manchester airport link (remember the days when HS2 was about not needing a third runway at Heathrow?) and building the case for a new underground station at Piccadilly.,2025-09-09T09:08:12.669Z,2025-09-09T09:08:13.429Z,1,0,0,False,HS2
at://did:plc:oo3kppddak7qrhuyzgvozldb/app.bsky.feed.post/3lyfemgfl5s2u,oldtrotter.bsky.social,David Higham,"It is and IMO was always more important than HS2 which did more to connect northern cities to London, than to each other, and it’s the latter which will build the economic counterweight to London and, now, OxCam. This is really about how you sell the concept. The HS badge is part of",2025-09-09T09:08:12.668Z,2025-09-09T09:08:13.403Z,1,0,1,False,HS2
at://did:plc:xodwj4pm66hy7gv5h6avg5vd/app.bsky.feed.post/3lyfds2ss5k2q,roylonergan.bsky.social,Roy Lonergan,"Would be spectacularly dum given what’s happened to HS2. 

But I assume that Northern Rail is popular in the north?",2025-09-09T08:53:28.101Z,2025-09-09T08:53:29.102Z,1,0,1,False,HS2
at://did:plc:2lgte4m73ojrhrpdj3eqbfgu/app.bsky.feed.post/3lyfdejtd5k2f,gusiluztrenes.bsky.social,Gusiluz,"6️⃣ No encuentro otro tren ni otro momento para los ""ensayos en vía a velocidad máxima con resultados positivos"".

En 2017 Talgo presentó el G4 (con tracción distribuida) para la HS2 británica, donde pedían 360 km/h.

Hace años que -en la página de innovaciones de Talgo- hablan sucintamente de",2025-09-09T08:45:53.807Z,2025-09-09T08:46:08.849Z,0,0,1,True,HS2
at://did:plc:adhaodx6jbahemr4pixbxkpq/app.bsky.feed.post/3lyf6eqczqs2y,mayfaircynic.bsky.social,Mayfair Cynic,"Big, broad, bold messaging from the Greens, but... no change on HS2? Nuclear Power?
(I know... it's early days yet)",2025-09-09T07:16:32.184Z,2025-09-09T07:16:31.801Z,0,0,0,False,HS2
at://did:plc:ujr5fulk4wep72wztvxbhoqs/app.bsky.feed.post/3lyf5ge3ckk2c,cllrandyoddy.bsky.social,CllrAndyOddy,Some of the so called red wall in the Sheffield/Doncaster/Wakefield area (those who never use trains) might like this (they never wanted HS2) but the Liverpool/Manchester/Leeds commuters most certainly will not like it.,2025-09-09T06:59:32.714Z,2025-09-09T06:59:35.403Z,0,0,1,True,HS2
at://did:plc:ni4gx7l7unbqlcblpxnunboa/app.bsky.feed.post/3lyeba6frn22h,chholden.bsky.social,Holden,"A concise, clear explainer video on how the ripple effects of cancelling HS2 to Manchester also mean many current trains will become shorter and busier. Don't let the video's quite technical title or graphic put you off - it is very watchable & an excellent summary of current situation",2025-09-08T22:35:00.667Z,2025-09-08T22:35:03.303Z,1,0,0,True,HS2
at://did:plc:qz3fopoj6yixtnbfiidfhuqy/app.bsky.feed.post/3lydzu76c3t23,hsrailgroup.bsky.social,High Speed Rail Group,"Watch 1,631-tonne West Midlands HS2 bridge being moved into place during the night.",2025-09-08T20:23:01.180Z,2025-09-08T20:23:02.908Z,0,0,0,True,HS2
at://did:plc:gycaeuzp3w4gvh7coom6knvd/app.bsky.feed.post/3lyds47632s2s,mdhoefsmit.bsky.social,Michiel,How finished is HS2? U.K. couldn’t fucking build a dam to prevent it from being flooded. These days,2025-09-08T18:04:21.119Z,2025-09-08T18:04:21.812Z,0,0,0,False,HS2
at://did:plc:7nshq442unjgqcrryflqu6a7/app.bsky.feed.post/3lydqpcnors2o,arj2024.bsky.social,Andrew Jones,"Without freedom of movement (into the UK) there's little chance of much building (or growth) happening even if the Government could do the building itself.

Having seen Government projects, like HS2, I'm pretty sceptical that it'd be any quicker.",2025-09-08T17:39:14.827Z,2025-09-08T17:39:14.104Z,0,0,0,False,HS2
at://did:plc:qz3fopoj6yixtnbfiidfhuqy/app.bsky.feed.post/3lydm2jszfg2l,hsrailgroup.bsky.social,High Speed Rail Group,Restored HS2 grassland begins to flourish.,2025-09-08T16:16:01.354Z,2025-09-08T16:16:03.704Z,0,0,0,True,HS2
at://did:plc:ysf5wjveiadwunhymx27v5wq/app.bsky.feed.post/3lydiv4ghrs2u,stefanpaetow.bsky.social,@stefanpaetow.bsky.social,I can tell you that it most definitely is not. The amount of changes in the DfT over the Johnson/Truss/Sunak years have driven the cost for HS2 through the roof and cost billions. Short-termism is now the in thing because no-one knows what the political winds bring in 6 months or a year.,2025-09-08T15:19:19.692Z,2025-09-08T15:19:20.508Z,0,0,0,False,HS2
at://did:plc:mtod2kzjkcyepqtjxlgcytpx/app.bsky.feed.post/3lydfxtd5os2v,billheywood.bsky.social,Bill Heywood,"Rishi Sunak was outstanding in his ineffectiveness

He achieved nothing worthwhile and only managed to make things worse. Wrecking the HS2 project is an outstanding example",2025-09-08T14:27:09.584Z,2025-09-08T14:27:10.913Z,4,0,0,False,HS2
at://did:plc:eidvwkd47poujx3enyeuw3a5/app.bsky.feed.post/3lydeetmhl22j,storywonker.bsky.social,Joel,"If you want to have your ear talked off for a couple of hours, ask a British transport wonk about the HS2 Bat Tunnel",2025-09-08T13:58:38.613Z,2025-09-08T13:58:39.806Z,2,0,0,False,HS2
